No.,大項目,中項目,ページ,単語,品詞,意味,発音,例文,和訳
1,ＮＨ,１年,2-5,morning,名詞,朝、午前,[モーニング],Good morning.,おはようございます。
2,ＮＨ,１年,2-5,name,名詞,名前,[ネーム],"Hi, my name is Ken.",こんにちは、私の名前はケンです。
3,ＮＨ,１年,2-5,tennis,名詞,テニス,[テニス],Hello! I'm Emma.,こんにちは！私はエマです。
6,ＮＨ,１年,2-5,my,代名詞,私の,[マイ],My cat is cute.,私の猫はかわいいです。
7,ＮＨ,１年,2-5,meet,動詞,…と会う,[ミート],I want to meet you.,あなたに会いたいです。
8,ＮＨ,１年,6-7,am,動詞,…です、…だ,[アム],I am from the city.,私は街の出身です。
9,ＮＨ,１年,6-7,is,動詞,…です、…だ,[イズ],This is an egg.,これは卵です。
10,ＮＨ,１年,6-7,like,動詞,…を好む、…が好きである,[ライク],I like music.,私は音楽が好きです。
12,ＮＨ,１年,6-7,nice,形容詞,すてきな、よい,[ナイス],That's a nice dress!,それは素敵なドレスですね！
13,ＮＨ,１年,6-7,good,形容詞,よい,[グッド],This pizza is really good.,このピザは本当においしいです。
14,ＮＨ,１年,6-7,yes,副詞,はい、ええ,[イエス],"Yes, I understand.",はい、わかりました。
19,ＮＨ,１年,8-9,cat,名詞,ネコ,[キャット],The cat is sleeping on the sofa.,猫がソファで寝ています。
20,ＮＨ,１年,8-9,dog,名詞,イヌ,[ドッグ],My dog loves to run in the park.,私の犬は公園を走るのが大好きです。
21,ＮＨ,１年,8-9,egg,名詞,卵,[エッグ],I ate a boiled egg for breakfast.,朝ごはんにゆで卵を食べました。
22,ＮＨ,１年,8-9,flower,名詞,花,[フラワー],She gave me a beautiful flower.,彼女は私にきれいな花をくれました。
23,ＮＨ,１年,8-9,tree,名詞,木、樹木,[ツリー],There is a big tree in the garden.,庭に大きな木があります。
24,ＮＨ,１年,8-9,city,名詞,市、都市、都会,[シティ],Tokyo is a big city.,東京は大きな都市です。
25,ＮＨ,１年,8-9,evening,名詞,夕方、晩,[イーブニング],I go for a walk in the evening.,私は夕方に散歩に行きます。
26,ＮＨ,１年,8-9,pen,名詞,ペン,[ペン],Can I borrow your pen?,あなたのペンを借りてもいいですか？
27,ＮＨ,１年,8-9,ten,数詞,10（の）,[テン],I have ten apples.,私はりんごを１０個持っています。
28,ＮＨ,１年,8-9,sun,名詞,太陽、日,[サン],The sun is shining.,太陽が輝いています。
29,ＮＨ,１年,8-9,cup,名詞,カップ,[カップ],I drank a cup of coffee.,私はコーヒーを一杯飲みました。
30,ＮＨ,１年,8-9,map,名詞,地図,[マップ],Let's look at the map.,地図を見ましょう。
31,ＮＨ,１年,8-9,TV,名詞,テレビ（放送）,[ティーヴィー],I watched a movie on TV.,私はテレビで映画を見ました。
32,ＮＨ,１年,8-9,box,名詞,箱,[ボックス],The gift is in the box.,プレゼントは箱の中にあります。
33,ＮＨ,１年,8-9,bag,名詞,かばん、バッグ,[バッグ],I put my books in the bag.,私はバッグに本を入れました。
34,ＮＨ,１年,8-9,desk,名詞,机,[デスク],The desk is next to the window.,デスクは窓の横にあります。
35,ＮＨ,１年,8-9,bed,名詞,ベッド,[ベッド],She is lying on the bed.,彼女はベッドに横たわっています。
36,ＮＨ,１年,8-9,apple,名詞,リンゴ,[アップル],I ate an apple for breakfast.,朝ごはんにりんごを食べました。
37,ＮＨ,１年,8-9,bat,名詞,バット,[バット],The bat flew across the sky.,コウモリが空を飛んでいました。
38,ＮＨ,１年,8-9,gorilla,名詞,ゴリラ,[ゴリラ],The gorilla is eating bananas.,ゴリラはバナナを食べています。
39,ＮＨ,１年,8-9,horse,名詞,ウマ,[ホース],The horse ran across the field.,馬は野原を駆け抜けました。
40,ＮＨ,１年,8-9,ink,名詞,インク,[インク],She wrote a letter with ink.,彼女はインクで手紙を書きました。
41,ＮＨ,１年,8-9,koala,名詞,コアラ,[コアラ],The koala is sleeping in the tree.,コアラは木の中で寝ています。
42,ＮＨ,１年,8-9,log,名詞,丸太,[ログ],The log was floating in the river.,丸太は川に浮かんでいました。
43,ＮＨ,１年,8-9,monkey,名詞,サル,[モンキー],The monkey is swinging from the tree.,猿は木から木へとぶら下がっています。
44,ＮＨ,１年,8-9,net,名詞,網、ネット,[ネット],He caught the ball with the net.,彼はネットでボールをキャッチしました。
45,ＮＨ,１年,8-9,octopus,名詞,タコ,[オクトパス],The octopus has eight arms.,タコには本の腕があります。
46,ＮＨ,１年,8-9,pan,名詞,フライパン,[パン],I fried eggs in a pan.,フライパンで卵を焼きました。
47,ＮＨ,１年,8-9,queen,名詞,女王、王妃,[クイーン],The queen wore a beautiful crown.,女王は美しい王冠をかぶっていました。
48,ＮＨ,１年,8-9,rabbit,名詞,ウサギ,[ラビット],The rabbit hopped across the garden.,うさぎは庭を跳ね回っていました。
49,ＮＨ,１年,8-9,snake,名詞,ヘビ,[スネーク],The snake slithered through the grass.,ヘビは草の中を這っていました。
50,ＮＨ,１年,8-9,umbrella,名詞,傘,[アンブレラ],She opened the umbrella because it was raining.,雨が降っていたので、彼女は傘を開きました。
51,ＮＨ,１年,8-9,wolf,名詞,オオカミ,[ウルフ],The wolf howled at the moon.,狼は月に向かって遠吠えをしました。
52,ＮＨ,１年,8-9,fox,名詞,キツネ,[フォックス],The fox ran quickly through the forest.,キツネは森の中を素早く走りました。
53,ＮＨ,１年,8-9,gym,名詞,体育館,[ジム],I work out at the gym every day.,私は毎日ジムでトレーニングをしています。
54,ＮＨ,１年,8-9,apron,名詞,エプロン,[エプロン],She wears an apron while cooking.,彼女は料理をしているとき、エプロンを着ます。
55,ＮＨ,１年,8-9,ice,名詞,氷,[アイス],I like to eat ice in summer.,夏に氷を食べるのが好きです。
56,ＮＨ,１年,8-9,ocean,名詞,大洋、海,[オーシャン],The ocean is very blue.,海はとても青いです。
57,ＮＨ,１年,8-9,uniform,名詞,制服、ユニフォーム,[ユニフォーム],He wears a uniform to school.,彼は学校に制服を着て行きます。
58,ＮＨ,１年,8-9,fan,名詞,扇、うちわ、扇風機,[ファン],The fan is spinning fast.,扇風機が速く回っています。
59,ＮＨ,１年,8-9,hat,名詞,（ふちのある）帽子,[ハット],I have a red hat.,私は赤い帽子を持っています。
60,ＮＨ,１年,8-9,cap,名詞,（ふちがない）帽子,[キャップ],He wore a cap to the game.,彼はゲームにキャップをかぶっていました。
61,ＮＨ,１年,8-9,mop,名詞,モップ,[モップ],I clean the floor with a mop.,私はモップで床を掃除します。
62,ＮＨ,１年,8-9,milk,名詞,牛乳、ミルク,[ミルク],I drink milk every morning.,私は毎朝牛乳を飲みます。
63,ＮＨ,１年,8-9,run,名詞,走る、運行している,[ラン],I run every day to stay healthy.,健康を保つために毎日走ります。
64,ＮＨ,１年,8-9,cut,名詞,…を切る,[カット],She will cut the paper with scissors.,彼女はハサミで紙を切ります。
65,ＮＨ,１年,8-9,jump,名詞,とぶ,[ジャンプ],I can jump very high.,私はとても高くジャンプできます。
66,ＮＨ,１年,8-9,hot,名詞,熱い、暑い,[ホット],This soup is too hot.,このスープはとても熱いです。
67,ＮＨ,１年,11-13,South Africa,固有名詞,南アフリカ共和国,[サウス アフリカ],I want to visit South Africa someday.,いつか南アフリカを訪れたいです。
68,ＮＨ,１年,11-13,call,動詞,…を（～と）呼ぶ、名づける,[コール],I will call you later.,後であなたに電話します。
69,ＮＨ,１年,11-13,love,名詞,…が好きである,[ラブ],I love playing soccer.,サッカーをするのが大好きです。
70,ＮＨ,１年,11-13,sweet,名詞,甘い菓子、キャンディー,[スウィート],The cake tastes sweet.,このケーキは甘いです。
71,ＮＨ,１年,11-13,club,名詞,クラブ、部,[クラブ],We belong to the same club.,私たちは同じクラブに所属しています。
72,ＮＨ,１年,11-13,number,名詞,数、数字,[ナンバー],My favorite number is seven.,私の好きな数字はです。
73,ＮＨ,１年,11-13,twelve,数詞,12（の）,[トゥエルブ],There are twelve months in a year.,年には１２ヶ月があります。
74,ＮＨ,１年,11-13,everyone,代名詞,みなさん、みんな,[エブリワン],Everyone is excited for the party.,みんなパーティーに興奮しています。
75,ＮＨ,１年,11-13,me,動詞,私を[に],[ミー],Can you help me?,手伝ってくれますか？
76,ＮＨ,１年,11-13,join,動詞（または名詞）,…に加わる、参加する,[ジョイン],Please join us for dinner.,夕食に参加してください。
77,ＮＨ,１年,11-13,Japanese,形容詞,日本の、日本人の,[ジャパニーズ],I speak Japanese.,私は日本語を話します。
78,ＮＨ,１年,11-13,too,名詞,…もまた。そのうえ,[トゥー],This book is too big.,この本はとても大きいです。
79,ＮＨ,１年,11-13,and,名詞,…と～,[アンド],I like coffee and tea.,私はコーヒーと紅茶が好きです。
80,ＮＨ,１年,11-13,from,前置詞,…から、…出身の,[フロム],She is from Japan.,彼女は日本から来ました。
81,ＮＨ,１年,11-13,the,冠詞,その,[ザ],The cat is sleeping.,猫が寝ています。
82,ＮＨ,１年,11-13,Call me ….,,私を…と呼んでください。,[コール ミー],Call me when you arrive.,着いたら私に電話してください。
83,ＮＨ,１年,11-13,want to,,…したい,[ウォント トゥ],I want to go home.,私は家に帰りたいです。
84,ＮＨ,１年,14-15,fan,名詞,ファン,[ファン],I'm a big fan of Mrs.,私はミセスの大ファンです。
85,ＮＨ,１年,14-15,often,副詞,しばしば、よく,[オフン],I often go to the gym.,私はよくジムに行きます。
86,ＮＨ,１年,14-15,but,接続詞,しかし、けれども,[バット],"I like pizza, but I don't like pasta.",ピザは好きですが、パスタは好きではありません。
87,ＮＨ,１年,14-15,with,前置詞,…といっしょに,[ウィズ],I study with my friend.,私は友達と一緒に勉強します。
88,ＮＨ,１年,14-15,friend,名詞（または動詞）,友達,[フレンド],I study with him.,私は彼と一緒に勉強します。
89,ＮＨ,１年,14-15,rugby,名詞,ラグビー,[ラグビー],I play rugby on the weekends.,週末にラグビーをします。
90,ＮＨ,１年,14-15,watch,動詞,…を（注意して）見る,[ウォッチ],I watch movies every night.,私は毎晩映画を見ます。
91,ＮＨ,１年,14-15,great,形容詞,すばらしい,[グレート],That was a great movie.,あれは素晴らしい映画でした。
92,ＮＨ,１年,14-15,no,形容詞,いいえ、いや,[ノー],"No, I don't like that.",いいえ、それは好きではありません。
93,ＮＨ,１年,14-15,not,副詞,…でない、…しない,[ノット],I am not tired.,私は疲れていません。
94,ＮＨ,１年,14-15,oh,感動詞,まあ、あら,[オー],"Oh, I forgot my keys.",ああ、鍵を忘れました。
95,ＮＨ,１年,14-15,don't,,do not の短縮形,[ドント],I don't like running.,私は走るのが好きではありません。
96,ＮＨ,１年,16-17,comic,名詞,マンガ,[コミック],I read a comic every week.,私は毎週漫画を読みます。
97,ＮＨ,１年,16-17,anime,名詞,アニメ,[アニメ],I love anime.,私はアニメが大好きです。
98,ＮＨ,１年,16-17,lesson,名詞,授業、レッスン,[レッスン],I have a math lesson today.,今日は数学の授業があります。
99,ＮＨ,１年,16-17,draw,動詞,（線画）をかく,[ドロー],I like to draw pictures.,私は絵を描くのが好きです。
100,ＮＨ,１年,16-17,so,接続詞,だから、それで,[ソー],The cake is so delicious.,このケーキはとても美味しいです。
101,ＮＨ,１年,16-17,about,副詞,…について、…に関する,[アバウト],I'm talking about my trip.,私は旅行について話しています。
102,ＮＨ,１年,16-17,an,冠詞（不定冠詞）,1つの、1人の,[アン],I have an art class tomorrow.,明日は美術の授業があります。
103,ＮＨ,１年,16-17,art,名詞,芸術、美術,[アート],I have an art class today.,今日は美術の授業があります。
104,ＮＨ,１年,16-17,school,名詞,学校,[スクール],I go to school every day.,私は毎日学校に行きます。
105,ＮＨ,１年,16-17,swimming,名詞（動名詞）,水泳,[スイミング],I like swimming in the pool.,私はプールで泳ぐのが好きです。
106,ＮＨ,１年,16-17,are,動詞（be動詞）,…です、（…に）いる,[アー],They are my friends.,彼らは私の友達です。
107,ＮＨ,１年,16-17,take,動詞,…を利用する、…を受ける,[テイク],I take the bus to school.,私は学校へバスで行きます。
108,ＮＨ,１年,16-17,how,疑問詞,どんなようす（ぐあい）で,[ハウ],How are you today?,元気ですか？
109,ＮＨ,１年,16-17,now,副詞,今、現在は,[ナウ],Let's eat now.,さあ、今食べましょう。
110,ＮＨ,１年,16-17,in,前置詞,…に所属して、参加して,[イン],My pencil is in the bag.,私の鉛筆はカバンの中にあります。
111,ＮＨ,１年,16-17,wow,感動詞,うわあ、わあ,[ワオ],"Wow, that's amazing!",わあ、すごい！
112,ＮＨ,１年,16-17,How about you?,,あなたはどうですか。,[ハウ アバウト ユー],I like soccerHow about you?,私はサッカーが好きです。あなたはどう？
113,ＮＨ,１年,19-21,class,名詞,学級、組、クラス,[クラス],Our class is very fun.,私たちのクラスはとても楽しいです。
114,ＮＨ,１年,19-21,Canada,固有名詞,カナダ,[カナダ],I'm from Canada.,私はカナダ出身です。
115,ＮＨ,１年,19-21,America,固有名詞,アメリカ（合衆国）,[アメリカ],She lives in America.,彼女はアメリカに住んでいます。
116,ＮＨ,１年,19-21,our,代名詞（所有格）,私たちの,[アワ],Our dog is very cute.,私たちの犬はとてもかわいいです。
117,ＮＨ,１年,19-21,Ms.,,[女性]…さん、先生,[ミズ],Ms. Lee is my teacher.,リー先生は私の先生です。
118,ＮＨ,１年,19-21,Mr.,,[男性]…さん、先生,[ミスター],Mr. Smith is very kind.,スミス先生はとても親切です。
119,ＮＨ,１年,19-21,teacher,名詞,先生、教師,[ティーチャー],My teacher is nice.,私の先生は優しいです。
120,ＮＨ,１年,19-21,team,名詞,チーム、組,[チーム],We have a great team.,私たちは素晴らしいチームを持っています。
121,ＮＨ,１年,19-21,he,代名詞,彼は[が],[ヒー],He is my brother.,彼は私の兄（弟）です。
122,ＮＨ,１年,19-21,she,代名詞,彼女は[が],[シー],She is my sister.,彼女は私の姉（妹）です。
123,ＮＨ,１年,19-21,new,形容詞,新しい、新任の,[ニュー],I have a new bag.,私は新しいカバンを持っています。
124,ＮＨ,１年,19-21,cool,形容詞,かっこいい,[クール],Your shoes are cool!,あなたの靴、かっこいいね！
125,ＮＨ,１年,19-21,on,前置詞,…の一員で、…に属して,[オン],The book is on the table.,本は机の上にあります。
126,ＮＨ,１年,19-21,at,前置詞,…は、…が、…に関しては,[アット],I'm good at English at school.,私は学校で英語が得意です。
127,ＮＨ,１年,19-21,he's,,he is の短縮形,[ヒーズ],He's my classmate.,彼は私のクラスメートです。
128,ＮＨ,１年,19-21,she's,,ｓhe is の短縮形,[シーズ],She's very smart.,彼女はとても頭がいいです。
129,ＮＨ,１年,19-21,be good at (…ing),,（…することが）じょうずだ、得意だ,[ビー グッド アット],I'm good at drawing.,私は絵を描くのが得意です。
130,ＮＨ,１年,22-23,parent,名詞,親、（複数形で）両親,[ペアレント],My parent is at work.,私の親は仕事中です。
131,ＮＨ,１年,22-23,China,固有名詞,中国,[チャイナ],He is from China.,彼は中国出身です。
132,ＮＨ,１年,22-23,cannot,助動詞（否定）,…できない,[キャノット],I cannot swim fast.,私は速く泳げません。
133,ＮＨ,１年,22-23,some,形容詞,いくつかの、いくらかの,[サム],I have some pencils.,私はいくつか鉛筆を持っています。
134,ＮＨ,１年,22-23,Chinese,形容詞・名詞（国籍・言語）,中国の,[チャイニーズ],I study Chinese at school.,私は学校で中国語を勉強しています。
135,ＮＨ,１年,22-23,food,名詞,食べ物,[フード],I like Chinese food.,私は中華料理が好きです。
136,ＮＨ,１年,22-23,father,名詞,父、お父さん,[ファーザー],My father is at home.,私の父は家にいます。
137,ＮＨ,１年,22-23,that,代名詞,そのこと、それ,[ザット],That is my bag.,あれは私のカバンです。
138,ＮＨ,１年,22-23,make,動詞,…を作る、得る,[メイク],I make lunch every day.,私は毎日昼ごはんを作ります。
139,ＮＨ,１年,22-23,read,動詞,（…を）読む、読んで知る,[リード],I read a book before bed.,寝る前に本を読みます。
140,ＮＨ,１年,22-23,see,動詞,（…が）わかる、理解する,[シー],I see a bird in the tree.,木の中に鳥が見えます。
141,ＮＨ,１年,22-23,can,助動詞,…することができる,[キャン],I can swim.,私は泳げます。
142,ＮＨ,１年,22-23,very,副詞,非常に、とても,[ベリー],She is very kind.,彼女はとても親切です。
143,ＮＨ,１年,22-23,well,副詞,じょうずに、うまく,[ウェル],He sings well.,彼は上手に歌います。
144,ＮＨ,１年,22-23,really,副詞（短縮形）,本当ですか、へえ,[リアリー],I really like this movie.,この映画が本当に好きです。
145,ＮＨ,１年,22-23,that's,,that is の短縮形,[ザッツ],That's my favorite song.,それは私のお気に入りの歌です。
146,ＮＨ,１年,22-23,can't,,cannnot の短縮形,[キャント],I can't play the piano.,私はピアノが弾けません。
147,ＮＨ,１年,22-23,I see.,,なるほど、わかった。,[アイ シー],I see.,なるほど。
148,ＮＨ,１年,24-25,excuse,動詞,…を許す,[エクスキューズ],"Excuse me, where is the bathroom?",すみません、トイレはどこですか？
149,ＮＨ,１年,24-25,welcome,形容詞,歓迎される,[ウェルカム],You're welcome.,どういたしまして。
150,ＮＨ,１年,24-25,here,副詞,さあ、ほら,[ヒア],Please sit here.,ここに座ってください。
151,ＮＨ,１年,24-25,oops,,おっと、うわっ,[ウップス],Oops! I dropped my pen.,おっと！ペンを落としました。
152,ＮＨ,１年,24-25,bird,名詞,鳥,[バード],A bird is flying.,鳥が飛んでいます。
153,ＮＨ,１年,24-25,your,代名詞,あなた（たち）の,[ユア],Is this your book?,これはあなたの本ですか？
154,ＮＨ,１年,24-25,it,代名詞,それは[が],[イット],It is a sunny day.,今日は晴れです。
155,ＮＨ,１年,24-25,thank,動詞,…に感謝する,[サンク],Thank you very much.,ありがとうございます。
156,ＮＨ,１年,24-25,you're,,you are の短縮形,[ユア],You're welcome.,どういたしまして。
157,ＮＨ,１年,24-25,it's,,it is の短縮形,[イッツ],It's cold today.,今日は寒いです。
158,ＮＨ,１年,24-25,Excuse me.,,すみません。失礼ですが。,[エクスキューズ ミー],Excuse me.,すみません。
159,ＮＨ,１年,24-25,Here you are.,,はい、どうぞ。,[ヒア ユー アー],Here you are.,はい、どうぞ。
160,ＮＨ,１年,24-25,Thank you.,,ありがとう。,[サンキュー],Thank you.,ありがとう。
161,ＮＨ,１年,24-25,You're welcome.,,どういたしまして。,[ユーアー ウェルカム],You're welcome.,どういたしまして。
162,ＮＨ,１年,26-27,e-mail,名詞,Ｅメール,[イーメール],I got your e-mail.,あなたのメールを受け取りました。
163,ＮＨ,１年,26-27,May,名詞,５月,[メイ],I was born in May.,私は５月生まれです。
164,ＮＨ,１年,26-27,green,名詞,緑（の）,[グリーン],I like green tea.,緑茶が好きです。
165,ＮＨ,１年,26-27,tea,名詞,茶、紅茶,[ティー],I don't like tea.,私は紅茶が好きではありません。
166,ＮＨ,１年,26-27,blue,名詞,青（の）,[ブルー],The sky is blue.,空は青いです。
167,ＮＨ,１年,26-27,juice,名詞,ジュース,[ジュース],I want some juice.,ジュースが欲しいです。
168,ＮＨ,１年,26-27,train,名詞,列車、電車,[トレイン],The train is late.,電車が遅れています。
169,ＮＨ,１年,26-27,rain,名詞,雨,[レイン],I don't like rain.,雨は好きではありません。
170,ＮＨ,１年,26-27,fruit,名詞,果物、果実,[フルーツ],I eat fruit every morning.,毎朝果物を食べます。
171,ＮＨ,１年,26-27,sea,名詞,海、海洋,[シー],I swim in the sea.,海で泳ぎます。
172,ＮＨ,１年,26-27,season,名詞,季節,[シーズン],Spring is my favorite season.,春は私の好きな季節です。
173,ＮＨ,１年,26-27,day,名詞,日、１日,[デイ],Today is a good day.,今日はいい日です。
174,ＮＨ,１年,26-27,book,名詞,本,[ブック],I bought a new book.,新しい本を買いました。
175,ＮＨ,１年,26-27,room,名詞,部屋,[ルーム],My room is clean.,私の部屋はきれいです。
176,ＮＨ,１年,26-27,classroom,名詞,教室,[クラスルーム],Our classroom is big.,私たちの教室は広いです。
177,ＮＨ,１年,26-27,textbook,名詞,教科書,[テキストブック],I opened my textbook.,教科書を開きました。
178,ＮＨ,１年,26-27,notebook,名詞,ノート,[ノートブック],This is my notebook.,これは私のノートです。
179,ＮＨ,１年,26-27,today,名詞,今日（は）、現在（では）,[トゥデイ],Today is Monday.,今日は月曜日です。
180,ＮＨ,１年,26-27,glue,名詞,接着剤、のり,[グルー],Use glue to make it stick.,くっつけるにはのりを使ってください。
181,ＮＨ,１年,26-27,beef,名詞,牛肉,[ビーフ],I ate beef for dinner.,夕食に牛肉を食べました。
182,ＮＨ,１年,26-27,peach,名詞,モモ,[ピーチ],She likes peach juice.,彼女はピーチジュースが好きです。
183,ＮＨ,１年,26-27,beach,名詞,浜、海辺、ビーチ,[ビーチ],I went to the beach.,ビーチに行きました。
184,ＮＨ,１年,26-27,cheese,名詞,チーズ,[チーズ],I like cheese.,チーズが好きです。
185,ＮＨ,１年,26-27,zoo,名詞,動物園,[ズー],Let's go to the zoo.,動物園に行きましょう。
186,ＮＨ,１年,26-27,swimming pool,名詞,プール,[スイミング プール],The swimming pool is open.,プールが開いています。
187,ＮＨ,１年,26-27,cooking,名詞,料理、料理法,[クッキング],I like cooking with my mom.,お母さんと一緒に料理するのが好きです。
188,ＮＨ,１年,26-27,green tea,名詞,緑茶,[グリーン ティー],Green tea is healthy.,緑茶は健康に良いです。
189,ＮＨ,１年,26-27,speak,動詞,（ある言語を）話す,[スピーク],I can speak English.,私は英語が話せます。
190,ＮＨ,１年,26-27,cook,動詞,（…を）料理する,[クック],He can cook well.,彼は料理が上手です。
191,ＮＨ,１年,26-27,drink,動詞,…を飲む,[ドリンク],I drink milk every morning.,毎朝牛乳を飲みます。
192,ＮＨ,１年,26-27,rainy,形容詞,雨の、雨の多い,[レイニー],It's a rainy day.,今日は雨の日です。
193,ＮＨ,１年,26-27,usually,副詞,たいてい、ふつう,[ユージュアリー],I usually walk to school.,たいてい歩いて学校に行きます。
194,ＮＨ,１年,31-33,character,名詞,登場人物,[キャラクター],That character is funny.,そのキャラクターは面白いです。
195,ＮＨ,１年,31-33,symbol,名詞,シンボル、記号,[シンボル],What does this symbol mean?,この記号は何を意味しますか？
196,ＮＨ,１年,31-33,interesting,形容詞,おもしろい、興味深い,[インタレスティング],This book is interesting.,この本は面白いです。
197,ＮＨ,１年,31-33,favorite,形容詞,いちばん好きな、お気に入りの,[フェイバリット],My favorite color is blue.,私の好きな色は青です。
198,ＮＨ,１年,31-33,also,副詞,…もまた、そのうえ,[オルソー],I also like cats.,私も猫が好きです。
199,ＮＨ,１年,31-33,for,前置詞,…のかわりに、…に相当する,[フォー],This gift is for you.,このプレゼントはあなたのためです。
200,ＮＨ,１年,31-33,family,名詞,一族,[ファミリー],I love my family.,私は家族が大好きです。
201,ＮＨ,１年,31-33,what,疑問詞,何、どんなもの[こと],[ホワット],What is your name?,あなたの名前は何ですか？
202,ＮＨ,１年,31-33,who,疑問詞,だれ、だれが,[フー],Who is that girl?,あの女の子は誰ですか？
