No.,大項目,中項目,ページ,単語,品詞,意味,発音,例文,和訳
191,ＢＳ,１年,24-25,trial,形容詞,お試しの、体験版の,[トライアル],Try the trial lesson.,体験レッスンを受けてみてください。
192,ＢＳ,１年,24-25,bird,名詞,鳥,[バード],I saw a bird.,私は鳥を見ました。
193,ＢＳ,１年,24-25,white,形容詞,白(い[の]),[ホワイト],The bird is white.,その鳥は白いです。
194,ＢＳ,１年,24-25,brown,形容詞,茶色（い[の]）,[ブラウン],The dog is brown.,その犬は茶色いです。
195,ＢＳ,１年,24-25,tea,名詞,お茶、紅茶,[ティー],I drink tea.,私はお茶を飲みます。
196,ＢＳ,１年,24-25,newspaper,名詞,新聞,[ニューズペーパー],I read the newspaper.,私は新聞を読みます。
197,ＢＳ,１年,24-25,room,名詞,部屋,[ルーム],This is my room.,これが私の部屋です。
198,ＢＳ,１年,24-25,dish,名詞,皿、料理,[ディッシュ],I wash the dish.,私はお皿を洗います。
199,ＢＳ,１年,24-25,look,動詞,[意識して]見る,[ルック],Look at the board.,ボードを見てください。
200,ＢＳ,１年,24-25,see,動詞,わかる、理解する,[シー],I can see a bird.,私は鳥が見えます。
201,ＢＳ,１年,24-25,enjoy,動詞,～を楽しむ,[エンジョイ],I enjoy dancing.,私はダンスを楽しみます。
202,ＢＳ,１年,24-25,eat,動詞,～を食べる,[イート],I eat lunch at school.,私は学校で昼ごはんを食べます。
203,ＢＳ,１年,24-25,drink,動詞,～を飲む,[ドリンク],I drink juice.,私はジュースを飲みます。
204,ＢＳ,１年,24-25,clean,動詞,～を掃除する,[クリーン],I need to clean my room.,私は部屋を掃除する必要があります。
205,ＢＳ,１年,24-25,wash,動詞,～を洗う,[ワッシュ],Please wash your hands before dinner.,夕食前に手を洗ってください。
206,ＢＳ,１年,24-25,right,名詞,正しい,[ライト],This is the right way to do it.,これは正しい方法です。
207,ＢＳ,１年,24-25,"～, right?",,～ですよね。,"[～, ライト?]","This is a trial session, right?",これは体験セッションですよね？
208,ＢＳ,１年,24-25,trial session,,お試し期間、体験入部,[トライアル セッション],He joined a trial session.,彼はトライアルセッションに参加した。
209,ＢＳ,１年,26-28,meter,名詞,メートル,[メーター],The ruler is one meter long.,定規は1メートルの長さです。
210,ＢＳ,１年,26-28,any,形容詞,［疑問文で］何か、どれか,[エニー],You can choose any color you like.,好きな色をどれでも選んでいいよ。
211,ＢＳ,１年,26-28,someday,副詞,いつか、そのうち,[サムデイ],I want to be a singer someday.,いつか歌手になりたいです。
212,ＢＳ,１年,26-28,instrument,名詞,楽器,[インストゥルメント],He is playing a musical instrument.,彼は楽器を演奏しています。
213,ＢＳ,１年,26-28,omelet,名詞,オムレツ,[オムレツ],She made an omelet for breakfast.,彼女は朝食にオムレツを作りました。
214,ＢＳ,１年,26-28,fifty,数詞,50(の),[フィフティ],There are fifty students in the class.,クラスには50人の生徒がいます。
215,ＢＳ,１年,26-28,swimming,名詞,水泳,[スイミング],I like swimming in the pool.,私はプールで泳ぐのが好きです。
216,ＢＳ,１年,26-28,that,代名詞,あれ、それ、あの人[物、事],[ザット],That book is interesting.,あの本はおもしろいです。
217,ＢＳ,１年,26-28,that's,,[that is の短縮形],[ザッツ],That's my favorite song.,それは私のお気に入りの歌です。
218,ＢＳ,１年,26-28,musical,名詞,音楽の,[ミュージカル],She plays a musical instrument.,彼女は楽器を演奏します。
219,ＢＳ,１年,26-28,reading,名詞,読書,[リーディング],I enjoy reading every night.,私は毎晩読書を楽しみます。
220,ＢＳ,１年,26-28,player,名詞,[スポーツを]する人、演奏する人,[プレイヤー],He is a good soccer player.,彼はよいサッカー選手です。
221,ＢＳ,１年,26-28,badminton,名詞,バドミントン,[バドミントン],We play badminton on Sundays.,私たちは日曜日にバドミントンをします。
222,ＢＳ,１年,26-28,running,名詞,ランニング,[ランニング],Running is good for your health.,ランニングは健康に良いです。
223,ＢＳ,１年,26-28,cool,形容詞,かっこいい,[クール],This jacket is really cool.,このジャケットは本当にかっこいいです。
224,ＢＳ,１年,33-35,video,名詞,ビデオ,[ビデオ],I watched a funny video.,私は面白い動画を見ました。
225,ＢＳ,１年,33-35,video game,名詞,テレビゲーム,[ビデオ ゲーム],My brother loves video games.,弟はテレビゲームが大好きです。
226,ＢＳ,１年,33-35,especially,副詞,特に、特別に,[エスペシャリー],"I like fruit, especially apples.",私は果物が好きです、特にリンゴが。
227,ＢＳ,１年,33-35,sister,名詞,姉、妹,[シスター],My sister is very kind.,私の妹はとても優しいです。
228,ＢＳ,１年,33-35,mechanical pencil,名詞,シャープペンシル,[メカニカル ペンシル],I write with a mechanical pencil.,私はシャープペンシルで書きます。
229,ＢＳ,１年,33-35,so,副詞,それほど、そんなに,[ソー],"I was tired, so I went to bed early.",疲れたので早く寝ました。
230,ＢＳ,１年,33-35,wow,,[驚きや喜びを表して]うわあ,[ワウ],"Wow, that's amazing!",わあ、それはすごい！
231,ＢＳ,１年,33-35,three,数詞,３、３つ（の）,[スリー],He has three cats.,彼は猫を3匹飼っています。
232,ＢＳ,１年,33-35,four,数詞,４、４つ(の),[フォー],I need four pens.,私はペンを4本必要です。
233,ＢＳ,１年,33-35,seven,数詞,７、７つ（の）,[セブン],Seven people came to the party.,7人がパーティーに来ました。
234,ＢＳ,１年,33-35,picture,名詞,写真、絵,[ピクチャー],This is a picture of my dog.,これは私の犬の写真です。
235,ＢＳ,１年,33-35,pencil,名詞,鉛筆,[ペンシル],Please give me a pencil.,鉛筆をください。
236,ＢＳ,１年,33-35,ruler,名詞,定規,[ルーラー],Use a ruler to draw a straight line.,定規を使ってまっすぐな線を引いてください。
237,ＢＳ,１年,33-35,eraser,名詞,消しゴム,[イレーザー],I need an eraser to fix my mistake.,間違いを直すために消しゴムが必要です。
238,ＢＳ,１年,33-35,marker,名詞,マーカー（ペン）,[マーカー],She drew a flower with a marker.,彼女はマーカーで花を描きました。
239,ＢＳ,１年,33-35,crayon,名詞,クレヨン,[クレヨン],The child used a crayon to draw.,その子はクレヨンで絵を描きました。
240,ＢＳ,１年,33-35,glue,名詞,接着剤、のり,[グルー],Use glue to stick the paper.,紙を貼るのにのりを使ってください。
241,ＢＳ,１年,36-37,week,名詞,週,[ウィーク],We have a test next week.,来週テストがあります。
242,ＢＳ,１年,36-37,once,名詞,１度、１回,[ワンス],I go shopping once a week.,私は週に一度買い物に行きます。
243,ＢＳ,１年,36-37,blue,名詞,青（い／の）,[ブルー],My bag is blue.,私のかばんは青いです。
244,ＢＳ,１年,36-37,green,名詞,緑（の）,[グリーン],The grass is green.,草は緑色です。
245,ＢＳ,１年,36-37,math,名詞,数学,[マス],Math is my favorite subject.,数学は私の好きな教科です。
246,ＢＳ,１年,36-37,subject,名詞,教科,[サブジェクト],What subject do you like?,どんな教科が好きですか。
247,ＢＳ,１年,36-37,skiing,名詞,スキー,[スキーイング],I enjoy skiing in winter.,私は冬にスキーを楽しみます。
248,ＢＳ,１年,36-37,skating,名詞,スケート,[スケーティング],They went skating at the rink.,彼らはスケート場でスケートをしました。
249,ＢＳ,１年,36-37,go,動詞,行く,[ゴー],Let's go to the park.,公園に行こう。
250,ＢＳ,１年,36-37,four days a week,,週に４日,[フォー デイズ ア ウィーク],I go to the gym four days a week.,私は週に4回ジムに行きます。
251,ＢＳ,１年,36-37,once a week,,週に１日,[ワンス ア ウィーク],We eat out once a week.,私たちは週に一度外食します。
252,ＢＳ,１年,36-37,"Me, too.",,私もです。,"[ミー, トゥー]","Me, too. I like pizza.",私もピザが好きです。
253,ＢＳ,１年,38-40,market,名詞,市場,[マーケット],We went to the market on Sunday.,私たちは日曜日に市場に行きました。
254,ＢＳ,１年,38-40,chicken rice,,チキンライス,[チキン ライス],I ate chicken rice for lunch.,昼食にチキンライスを食べました。
255,ＢＳ,１年,38-40,them,代名詞,彼（女）らに[を]、それらに[を],[ゼム],Give the books to them.,本を彼らに渡してください。
256,ＢＳ,１年,38-40,miss,動詞,～を恋しく思う,[ミス],I miss my dog.,犬が恋しいです。
257,ＢＳ,１年,38-40,stay,動詞,滞在する,[ステイ],We will stay at a hotel.,私たちはホテルに泊まる予定です。
258,ＢＳ,１年,38-40,tropical,形容詞,熱帯（地方）の,[トロピカル],Pineapples grow in tropical places.,パイナップルは熱帯地域で育ちます。
259,ＢＳ,１年,38-40,Singaporean,固有名詞,シンガポール（人）の,[シンガポリアン],He is a Singaporean student.,彼はシンガポール人の学生です。
260,ＢＳ,１年,38-40,little,形容詞,少なく,[リトル],There is a little milk left.,牛乳が少し残っています。
261,ＢＳ,１年,38-40,dinner,名詞,夕食,[ディナー],We had curry for dinner.,夕食にカレーを食べました。
262,ＢＳ,１年,38-40,breakfast,名詞,朝食,[ブレックファスト],I had eggs for breakfast.,朝食に卵を食べました。
263,ＢＳ,１年,38-40,a little,,少し,[ア リトル],Add a little salt to the soup.,スープに少し塩を加えてください。
264,ＢＳ,１年,38-40,Not really.,,[軽い否定]それほどでもない。,[ノット リアリー],Not really. I don't like horror movies.,あまり好きじゃないです。ホラー映画は。
265,ＢＳ,１年,38-40,party,名詞,パーティー,[パーティ],We had a fun party last night.,昨夜は楽しいパーティーがありました。
266,ＢＳ,１年,38-40,need,動詞,～を必要とする,[ニード],I need more time to finish.,仕上げるのにもっと時間が必要です。
267,ＢＳ,１年,38-40,orange,名詞,オレンジ[果物],[オレンジ],She drank a glass of orange juice.,彼女はオレンジジュースを飲みました。
268,ＢＳ,１年,38-40,pie,名詞,パイ,[パイ],He baked an apple pie.,彼はアップルパイを焼きました。
269,ＢＳ,１年,38-40,peach,名詞,モモ,[ピーチ],I ate a sweet peach.,私は甘い桃を食べました。
270,ＢＳ,１年,38-40,make,動詞,～を作る,[メイク],Let's make a cake together.,一緒にケーキを作ろう。
271,ＢＳ,１年,38-40,All right.,,承知しました。,[オール ライト],"All right, let's start!",よし、始めよう！
272,ＢＳ,１年,43-45,Canada,固有名詞,カナダ[国名],[カナダ],He is from Canada.,彼はカナダ出身です。
273,ＢＳ,１年,43-45,North America,固有名詞,北アメリカ,[ノース アメリカ],Mexico is in North America.,メキシコは北アメリカにあります。
274,ＢＳ,１年,43-45,ice hockey,名詞,アイスホッケー,[アイス ホッケー],They play ice hockey in winter.,彼らは冬にアイスホッケーをします。
275,ＢＳ,１年,43-45,unique,形容詞,独特の,[ユニーク],Her dress is very unique.,彼女のドレスはとてもユニークです。
276,ＢＳ,１年,43-45,also,副詞,そのうえ、さらに,[オールソ],I also like music.,私も音楽が好きです。
277,ＢＳ,１年,43-45,it's,,it is の短縮形,[イッツ],It's my favorite movie.,それは私のお気に入りの映画です。
278,ＢＳ,１年,43-45,university,名詞,大学,[ユニバーシティ],He goes to university in Tokyo.,彼は東京の大学に通っています。
279,ＢＳ,１年,43-45,major,名詞,[大学などでの]専攻,[メイジャー],My major is biology.,私の専攻は生物学です。
280,ＢＳ,１年,43-45,production,名詞,制作,[プロダクション],The production was amazing.,その作品は素晴らしかったです。
281,ＢＳ,１年,43-45,nickname,名詞,ニックネーム,[ニックネーム],His nickname is Max.,彼のニックネームはマックスです。
282,ＢＳ,１年,43-45,classmate,名詞,同級生、クラスメート,[クラスメート],She is my classmate.,彼女は私のクラスメートです。
283,ＢＳ,１年,43-45,his,代名詞,彼の,[ヒズ],This is his bag.,これは彼のかばんです。
284,ＢＳ,１年,43-45,anyone,代名詞,[否定文で]だれとでも,[エニワン],Has anyone seen my phone?,誰か私の携帯を見ませんでしたか？
285,ＢＳ,１年,43-45,him,代名詞,彼を[に],[ヒム],I gave the book to him.,私は彼に本をあげました。
286,ＢＳ,１年,43-45,her,代名詞,彼女の,[ハー],We saw her at the park.,私たちは公園で彼女を見かけました。
287,ＢＳ,１年,43-45,active,形容詞,活発な,[アクティブ],He is very active.,彼はとても活動的です。
288,ＢＳ,１年,43-45,outgoing,形容詞,社交的な,[アウトゴーイング],She is outgoing and friendly.,彼女は社交的で明るいです。
289,ＢＳ,１年,43-45,now,副詞,今,[ナウ],Let's do it now.,今やろう。
290,ＢＳ,１年,43-45,anything,代名詞,[疑問文・否定文で]何か、何も,[エニシング],I don't want anything.,何もほしくありません。
291,ＢＳ,１年,43-45,large,形容詞,[形、面積、容器が]大きい,[ラージ],The elephant is large.,ゾウは大きいです。
292,ＢＳ,１年,46-47,host,名詞,[客をもてなす]主人,[ホスト],The host welcomed the guests.,司会者はゲストを歓迎しました。
293,ＢＳ,１年,46-47,man,名詞,人、人間,[マン],The man is my uncle.,その男性は私のおじです。
294,ＢＳ,１年,46-47,coach,名詞,[競技の] コーチ,[コーチ],Our coach is kind.,私たちのコーチは優しいです。
295,ＢＳ,１年,46-47,woman,名詞,女の人、女性,[ウーマン],The woman is a doctor.,その女性は医者です。
296,ＢＳ,１年,46-47,pianist,名詞,ピアニスト,[ピアニスト],She wants to be a pianist.,彼女はピアニストになりたいです。
297,ＢＳ,１年,46-47,family,名詞,家庭,[ファミリー],My family is very close.,私の家族はとても仲が良いです。
298,ＢＳ,１年,46-47,red,名詞,赤（い[の]）,[レッド],He wore a red jacket.,彼は赤いジャケットを着ていました。
299,ＢＳ,１年,46-47,T-shirt,名詞,Tシャツ,[T-シャツ],I like your T-shirt.,あなたのTシャツが好きです。
300,ＢＳ,１年,46-47,father,名詞,父親、お父さん,[ファザー],My father is strong.,私の父は力持ちです。
301,ＢＳ,１年,46-47,scientist,名詞,科学者,[サイエンティスト],She is a scientist.,彼女は科学者です。
302,ＢＳ,１年,46-47,girl,名詞,女の子、少女,[ガール],The girl is playing.,その女の子は遊んでいます。
303,ＢＳ,１年,46-47,boy,名詞,男の子、少年,[ボーイ],The boy is running.,その男の子は走っています。
304,ＢＳ,１年,46-47,grandmother,名詞,おばあさん、祖母,[グランドマザー],My grandmother makes cookies.,私の祖母はクッキーを作ります。
305,ＢＳ,１年,46-47,who,疑問詞,だれ（が[を]）,[フー],Who is that person?,あの人は誰ですか？
306,ＢＳ,１年,46-47,famous,形容詞,有名な,[フェイマス],He is a famous singer.,彼は有名な歌手です。
307,ＢＳ,１年,46-47,who's,,who is の短縮形,[フーズ],Who's at the door?,ドアにいるのは誰？
308,ＢＳ,１年,46-47,tall,形容詞,[人が]背の高い、[木や建物が]高い,[タル],He is tall and strong.,彼は背が高くてたくましいです。
309,ＢＳ,１年,48-50,quiz,名詞,クイズ,[クイズ],We had a quiz today.,今日はクイズがありました。
310,ＢＳ,１年,48-50,baby,名詞,赤ちゃん,[ベイビー],The baby is sleeping.,赤ちゃんは眠っています。
311,ＢＳ,１年,48-50,horn,名詞,ツノ,[ホーン],The car has a loud horn.,その車は大きなクラクションの音がします。
312,ＢＳ,１年,48-50,they,代名詞,彼（女）ら[それら]は[が],[ゼイ],They are my friends.,彼らは私の友達です。
313,ＢＳ,１年,48-50,round,形容詞,丸い,[ラウンド],The moon is round.,月は丸いです。
314,ＢＳ,１年,48-50,northeastern,形容詞,北東の、北東部の,[ノースイースタン],I live in the northeastern part of the city.,私は市の北東部に住んでいます。
315,ＢＳ,１年,48-50,like,前置詞,[類似性を示す]～のように[な],[ライク],I like your style.,あなたのスタイルが好きです。
316,ＢＳ,１年,48-50,what's,,what is の短縮形,[ホワッツ],What's your favorite color?,あなたの好きな色は何ですか？
317,ＢＳ,１年,48-50,they're,,they are の短縮形,[ゼイアー],They're my best friends.,彼らは私の親友です。
318,ＢＳ,１年,48-50,one,代名詞,[前に出た数えられる名詞をくり返す代わりに使って]もの,[ワン],I have one sister.,私は妹が1人います。
319,ＢＳ,１年,48-50,a kind of ～,,ある種の～,[ア カインド オブ ～],Soccer is a kind of sport.,サッカーはスポーツの一種です。
320,ＢＳ,１年,48-50,athlete,名詞,運動選手,[アスリート],She is a great athlete.,彼女は素晴らしいアスリートです。
321,ＢＳ,１年,48-50,fourth,数詞,４番目（の）、４日,[フォース],He came in fourth place.,彼は4位になりました。
322,ＢＳ,１年,48-50,ostrich,名詞,ダチョウ,[オストリッチ],An ostrich is a large bird.,ダチョウは大きな鳥です。
323,ＢＳ,１年,48-50,kiwi,名詞,キウイ[鳥],[キウイ],"A kiwi is a small, flightless bird.",キーウィは小さな飛べない鳥です。
324,ＢＳ,１年,48-50,prefecture,名詞,都道府県,[プレフェクチャー],Kyoto is a famous prefecture in Japan.,京都は日本の有名な都道府県です。
325,ＢＳ,１年,48-50,professional,形容詞,プロ（の）,[プロフェッショナル],He is a professional dancer.,彼はプロのダンサーです。
326,ＢＳ,１年,48-50,hint,名詞,ヒント,[ヒント],Here's a hint for the answer.,これは答えのヒントです。
327,ＢＳ,１年,48-50,fly,動詞,飛ぶ,[フライ],Birds can fly in the sky.,鳥は空を飛べます。
328,ＢＳ,１年,51,dollar,名詞,ドル[アメリカ合衆国の通貨],[ダラー],It costs one dollar.,それは1ドルです。
329,ＢＳ,１年,51,moment,名詞,瞬間、ちょっとの間,[モーメント],"Wait a moment, please.",ちょっと待ってください。
330,ＢＳ,１年,51,clerk,名詞,店員,[クラーク],The clerk helped me at the store.,店員が私を助けてくれました。
331,ＢＳ,１年,51,size,名詞,サイズ、大きさ,[サイズ],Do you have this in a larger size?,これのもっと大きいサイズはありますか？
332,ＢＳ,１年,51,cent,名詞,セント[アメリカ合衆国の通貨],[セント],It costs fifty cents.,それは50セントです。
333,ＢＳ,１年,51,jacket,名詞,ジャケット、上着,[ジャケット],This jacket is warm.,このジャケットは暖かいです。
334,ＢＳ,１年,51,just,副詞,単に、ただ～だけ、ちょっと,[ジャスト],I just finished my homework.,ちょうど宿題を終えました。
335,ＢＳ,１年,51,fifteen,数詞,15（の）,[フィフティーン],She is fifteen years old.,彼女は15歳です。
336,ＢＳ,１年,51,forty,数詞,40（の）,[フォーティ],My uncle is forty years old.,私のおじは40歳です。
337,ＢＳ,１年,51,shirt,名詞,シャツ,[シャツ],He wore a blue shirt.,彼は青いシャツを着ていました。
338,ＢＳ,１年,51,sweater,名詞,セーター,[スウェーター],I bought a red sweater.,赤いセーターを買いました。
339,ＢＳ,１年,51,excuse,動詞,[人・行為]を許す,[エクスキューズ],"Excuse me, where is the station?",すみません、駅はどこですか？
340,ＢＳ,１年,51,medium,形容詞,[大きさ。程度・位置などが]中間の,[ミディアム],I wear a medium size.,私はMサイズを着ています。
341,ＢＳ,１年,51,"Just a moment, please.",,少々お待ちください。,"[ジャスト ア モーメント, プリーズ]","Just a moment, please.",少々お待ちください。
342,ＢＳ,１年,51,Excuse me.,,すみません。,[エクスキューズ ミー],Excuse me. Can you help me?,すみません。手伝ってくれますか？
343,ＢＳ,１年,53-54,hobby,名詞,趣味、道楽,[ホビー],Reading is my hobby.,読書は私の趣味です。
344,ＢＳ,１年,53-54,future,名詞,未来、将来,[フューチャー],I want to be a teacher in the future.,将来、先生になりたいです。
345,ＢＳ,１年,53-54,photography,名詞,写真撮影,[フォトグラフィー],My hobby is photography.,私の趣味は写真を撮ることです。
346,ＢＳ,１年,53-54,Spanish,名詞,スペイン語,[スパニッシュ],She studies Spanish at school.,彼女は学校でスペイン語を勉強しています。
347,ＢＳ,１年,53-54,speaker,名詞,話す人,[スピーカー],He is a good English speaker.,彼は英語が上手な話し手です。
348,ＢＳ,１年,53-54,around,前置詞,[位置]～の周りを,[アラウンド],Let's walk around the park.,公園のまわりを歩こう。
349,ＢＳ,１年,53-54,thing,名詞,こと、もの,[シング],This is my favorite thing.,これは私のお気に入りの物です。
350,ＢＳ,１年,53-54,speech,名詞,スピーチ、演説,[スピーチ],He gave a speech at school.,彼は学校でスピーチをしました。
351,ＢＳ,１年,53-54,comic book,名詞,マンガ本,[コミック ブック],I read a comic book last night.,昨夜、マンガを読みました。
352,ＢＳ,１年,53-54,yourself,代名詞,あなた（たち）自身（に[を]）,[ユアセルフ],Take care of yourself.,自分のことを大切にしてね。
353,ＢＳ,１年,53-54,prepare,動詞,～を準備する,[プリペア],Prepare well for the test.,テストの準備をしっかりしなさい。
354,ＢＳ,１年,53-54,more,形容詞,これ以上の、より多い,[モア],I want to learn more.,もっと学びたいです。
355,ＢＳ,１年,53-54,again,副詞,再び、もう一度,[アゲイン],Please try again.,もう一度やってください。
356,ＢＳ,１年,53-54,bye,,goodbye と同意,[バイ],Bye! See you later.,バイバイ！またね。
357,ＢＳ,１年,53-54,fun,名詞,おもしろいこと、楽しいこと,[ファン],The game was so much fun.,そのゲームはとても楽しかったです。
358,ＢＳ,１年,53-54,September,名詞,９月,[セプテンバー],My birthday is in September.,私の誕生日は9月です。
359,ＢＳ,１年,53-54,in the future,,これから、将来（に）,[イン ザ フューチャー],I want to travel a lot in the future.,将来、たくさん旅行したいです。
360,ＢＳ,１年,53-54,take a picture(s),,写真を撮る,[テイク ア ピクチャー(s)],Let's take a picture together.,一緒に写真を撮ろう。
361,ＢＳ,１年,55-57,island,名詞,島,[アイランド],Japan is an island country.,日本は島国です。
362,ＢＳ,１年,55-57,lot,,[a を付けて]たくさん,[ロット],We have a lot of homework.,宿題がたくさんあります。
363,ＢＳ,１年,55-57,people,名詞,人々,[ピープル],Many people came to the festival.,たくさんの人がその祭りに来ました。
364,ＢＳ,１年,55-57,learn,動詞,～を学ぶ、知る,[ラーン],I want to learn English.,私は英語を学びたいです。
365,ＢＳ,１年,55-57,fascinating,形容詞,魅力的な,[ファッシネイティング],Space is fascinating.,宇宙はとても魅力的です。
366,ＢＳ,１年,55-57,there,副詞,そこに[で],[ゼア],There is a cat on the roof.,屋根の上に猫がいます。
367,ＢＳ,１年,55-57,look at ～,,～を見る,[ルック アット ～],Look at that beautiful flower.,あのきれいな花を見て。
368,ＢＳ,１年,55-57,a lot of ～,,たくさんの～,[ア ロット オブ ～],We saw a lot of stars last night.,昨夜たくさんの星を見ました。
369,ＢＳ,１年,55-57,every year,,毎年,[エヴリ イヤー],We go skiing every year.,私たちは毎年スキーに行きます。
370,ＢＳ,１年,55-57,tour,名詞,旅行、ツアー,[ツアー],We joined a city tour.,私たちは市内観光に参加しました。
371,ＢＳ,１年,55-57,guide,名詞,ガイド,[ガイド],The guide showed us around.,ガイドが案内してくれました。
372,ＢＳ,１年,55-57,farm,名詞,農場、農園,[ファーム],They visited a big farm.,彼らは大きな農場を訪れました。
373,ＢＳ,１年,55-57,key,名詞,カギ,[キー],I can't find my key.,鍵が見つかりません。
