No.,大項目,中項目,ページ,単語,品詞,意味,発音,例文,和訳
450,ＢＳ,２年,75-77,confident,形容詞,自信がある,[コンフィデント],She is confident in her answer.,彼女は自分の答えに自信があります。
451,ＢＳ,２年,75-77,besides,副詞,その上、さらに,[ビサイド],"Besides English, I study math.",英語のほかに数学も勉強しています。
452,ＢＳ,２年,75-77,pronunciation,名詞,発音,[プロナンシエーション],Your pronunciation is good.,あなたの発音は良いです。
453,ＢＳ,２年,75-77,junior high,,junior high school の略称,[ジュニア・ハイ],I go to junior high school.,私は中学校に通っています。
454,ＢＳ,２年,75-77,Don't worry.,,心配しないで。,[ドント・ワーリー],"Don't worry, it's okay.",心配しないで、大丈夫です。
455,ＢＳ,２年,75-77,feel free to ～,,自由に～する,[フィール・フリー・トゥ ～],Feel free to ask questions.,気軽に質問してください。
456,ＢＳ,２年,78-79,childhood,名詞,子供時代,[チャイルドフッド],I remember my childhood well.,私は子ども時代をよく覚えています。
457,ＢＳ,２年,78-79,kindergarten,名詞,幼稚園,[キンダーガーテン],He started kindergarten today.,彼は今日、幼稚園に入りました。
458,ＢＳ,２年,78-79,fantasy,名詞,ファンタジー、空想,[ファンタジー],I like reading fantasy books.,私はファンタジーの本を読むのが好きです。
459,ＢＳ,２年,78-79,used to,,（以前は）～だった,[ユーズド・トゥ],I used to play soccer.,以前はサッカーをしていました。
460,ＢＳ,２年,78-79,terrible,形容詞,ひどい,[テリブル],The food was terrible.,その食べ物はひどかったです。
461,ＢＳ,２年,78-79,classical,形容詞,古典的な,[クラシカル],I listen to classical music.,私はクラシック音楽を聴きます。
462,ＢＳ,２年,78-79,comfortable,形容詞,快適な,[コンフォータブル],This chair is comfortable.,この椅子は快適です。
463,ＢＳ,２年,78-79,relaxed,形容詞,リラックスした,[リラックスド],I feel relaxed now.,今はリラックスしています。
464,ＢＳ,２年,78-79,bored,形容詞,退屈した、飽きている,[ボード],I was bored in class.,授業中、退屈でした。
465,ＢＳ,２年,78-79,memory,名詞,記憶,[メモリー],That is a happy memory.,それは幸せな思い出です。
466,ＢＳ,２年,78-79,refer to ～,,～のことを言う,[リファー・トゥ ～],This word may refer to animals.,この言葉は動物を指すかもしれません。
467,ＢＳ,２年,78-79,give a speech,,スピーチをする,[ギヴ・ア・スピーチ],I have to give a speech.,私はスピーチをしなければなりません。
468,ＢＳ,２年,78-79,classical music,,クラシック音楽,[クラシカル・ミュージック],Classical music calms me.,クラシック音楽は私を落ち着かせます。
469,ＢＳ,２年,80-81,letter,名詞,手紙,[レター],I got a letter yesterday.,昨日、手紙を受け取りました。
470,ＢＳ,２年,80-81,confidence,名詞,信頼、信用,[コンフィデンス],She has confidence in herself.,彼女は自分に自信を持っています。
471,ＢＳ,２年,80-81,myself,代名詞,私自身に、私自身を,[マイセルフ],I made it myself.,私は自分で作りました。
472,ＢＳ,２年,80-81,quiet,形容詞,静かな,[クワイエット],It's quiet here.,ここは静かです。
473,ＢＳ,２年,80-81,wake,動詞,～を起こす,[ウェイク],I wake at six.,私は6時に起きます。
474,ＢＳ,２年,80-81,thanks to ～,,～のおかげで,[サンクス・トゥ ～],"Thanks to you, I finished early.",あなたのおかげで早く終わりました。
475,ＢＳ,２年,80-81,Be quiet.,,静かにしなさい。,[ビー・クワイエット],"Be quiet, please.",静かにしてください。
476,ＢＳ,２年,80-81,wake ～ up,,～を起こす,[ウェイク ～ アップ],Please wake me up at 7.,7時に起こしてください。
477,ＢＳ,２年,80-81,do a great job,,よい仕事をする,[ドゥ・ア・グレート・ジョブ],You did a great job.,あなたは素晴らしい仕事をしました。
478,ＢＳ,２年,80-81,confidence in oneself,,自信　,[コンフィデンス・イン・ワンセルフ],Confidence in oneself is important.,自分に自信を持つことは大切です。
479,ＢＳ,２年,80-81,enjoy oneself,,楽しく過ごす,[エンジョイ・ワンセルフ],He enjoyed himself at the party.,彼はパーティーで楽しんでいました。
480,ＢＳ,２年,80-81,each one of you,,あなたたち一人ひとり,[イーチ・ワン・オブ・ユー],Each one of you did well.,みなさん一人ひとりがよく頑張りました。
481,ＢＳ,２年,82-84,attitude,名詞,態度、考え方,[アティチュード],His attitude is positive.,彼の態度は前向きです。
482,ＢＳ,２年,82-84,text message,名詞,テキストメッセージ,[テキスト・メッセージ],I sent a text message.,私はテキストメッセージを送りました。
483,ＢＳ,２年,82-84,record,動詞,～を録画する,[レコード],Let's record the song.,その歌を録音しましょう。
484,ＢＳ,２年,82-84,flatter,動詞,～にお世辞を言う,[フラッター],He tried to flatter the teacher.,彼は先生をおだてようとしました。
485,ＢＳ,２年,82-84,boring,形容詞,退屈な、つまらない,[ボーリング],The movie was boring.,その映画は退屈でした。
486,ＢＳ,２年,82-84,impressed,形容詞,感動した、感心した,[インプレスト],I'm impressed by her speech.,彼女のスピーチに感動しました。
487,ＢＳ,２年,82-84,exactly,副詞,おっしゃるとおり,[イグザクトリー],That's exactly right.,それはまさにその通りです。
488,ＢＳ,２年,82-84,hard,副詞,熱心な,[ハード],She works hard.,彼女は一生懸命働きます。
489,ＢＳ,２年,82-84,Not much.,,相変わらずです。,[ノット・マッチ],"Not much, just resting.",特に何もしていません、ただ休んでいます。
490,ＢＳ,２年,82-84,Come on.,,やめてよ。,[カム・オン],"Come on, let's go!",さあ、行こう！
491,ＢＳ,２年,82-84,to be honest,,正直に言うと,[トゥ・ビー・オネスト],"To be honest, I'm tired.",正直に言うと、疲れています。
492,ＢＳ,２年,82-84,one day,,ある日,[ワン・デイ],"One day, I'll travel the world.",いつか世界を旅したいです。
493,ＢＳ,２年,82-84,effort,名詞,努力,[エフォート],She made a great effort.,彼女は一生懸命頑張りました。
494,ＢＳ,２年,82-84,Christmas,名詞,クリスマス,[クリスマス],We decorated for Christmas.,私たちはクリスマスの飾り付けをしました。
495,ＢＳ,２年,82-84,progress,名詞,上達、進歩,[プログレス],You've made good progress.,あなたは大きな進歩をしました。
496,ＢＳ,２年,82-84,make mistake,,間違える,[メイク・ミステイク],I made a mistake.,私は間違えました。
497,ＢＳ,２年,82-84,keep ～ing,,～し続ける,[キープ ～ing],Keep trying!,頑張り続けて！
498,ＢＳ,２年,85、88-89,row,名詞,列,[ロウ],We sat in a row.,私たちは一列に座りました。
499,ＢＳ,２年,85、88-89,mind,動詞,～を気にする,[マインド],Do you mind if I sit here?,ここに座ってもいいですか？
500,ＢＳ,２年,85、88-89,still,副詞,まだ、なお,[スティル],He still studies every night.,彼は今でも毎晩勉強しています。
501,ＢＳ,２年,85、88-89,car,名詞,車,[カー],My car is red.,私の車は赤です。
502,ＢＳ,２年,85、88-89,never,副詞,決して～ない,[ネバー],I never lie.,私は決して嘘をつきません。
503,ＢＳ,２年,85、88-89,It's me.,,（電話で）私です。,[イッツ・ミー],It's me at the door.,ドアにいるのは私です。
504,ＢＳ,２年,85、88-89,call ～ back,,折り返し～に電話する,[コール ～ バック],I'll call you back later.,後でかけ直します。
505,ＢＳ,２年,85、88-89,on the way,,道中で、途中で,[オン・ザ・ウェイ],I saw him on the way.,途中で彼に会いました。
506,ＢＳ,２年,85、88-89,pick ～ up,,車で～を迎えに来る,[ピック ～ アップ],I'll pick you up at 5.,5時に迎えに行きます。
507,ＢＳ,２年,85、88-89,be home,,家に着く、いる,[ビー・ホーム],I'll be home soon.,すぐに帰宅します。
508,ＢＳ,２年,85、88-89,Never mind.,,大丈夫。気にしないで。,[ネバー・マインド],"Never mind, it's okay.",気にしないで、大丈夫です。
509,ＢＳ,２年,85、88-89,Bye for now.,,さよなら。じゃあね。,[バイ・フォー・ナウ],Bye for now!,またね！
510,ＢＳ,２年,85、88-89,exercise,名詞,運動,[エクササイズ],Let's do some exercise.,運動しましょう。
511,ＢＳ,２年,85、88-89,medicine,名詞,薬,[メディスン],I took some medicine.,私は薬を飲みました。
512,ＢＳ,２年,85、88-89,robot,名詞,ロボット,[ロボット],This robot can talk.,このロボットは話せます。
513,ＢＳ,２年,85、88-89,condition,名詞,状態,[コンディション],Her condition is better.,彼女の体調は良くなりました。
514,ＢＳ,２年,85、88-89,catch,動詞,（病気など）にかかる,[キャッチ],Don't catch a cold.,風邪をひかないでください。
515,ＢＳ,２年,85、88-89,physical,形容詞,身体の,[フィジカル],Physical activity is important.,身体活動は大切です。
516,ＢＳ,２年,85、88-89,healthy,形容詞,健康的な,[ヘルシー],I try to stay healthy.,私は健康を保つようにしています。
517,ＢＳ,２年,85、88-89,cold,名詞,風邪,[コールド],I have a cold.,風邪をひいています。
518,ＢＳ,２年,85、88-89,catch a cold,,風邪をひく,[キャッチ・ア・コールド],He caught a cold.,彼は風邪をひきました。
519,ＢＳ,２年,90-91,smile,動詞,ほほえむ,[スマイル],She has a nice smile.,彼女は素敵な笑顔をしています。
520,ＢＳ,２年,90-91,seem,動詞,～のように見える,[シーム],You seem happy.,あなたは幸せそうです。
521,ＢＳ,２年,90-91,careful,形容詞,注意深い,[ケアフル],Be careful with that!,それに気をつけて！
522,ＢＳ,２年,90-91,curious,形容詞,好奇心の強い,[キュリアス],I'm curious about that.,それについて興味があります。
523,ＢＳ,２年,90-91,quickly,副詞,素早く、すぐに,[クイックリー],He ran quickly.,彼は素早く走りました。
524,ＢＳ,２年,90-91,outside,副詞,屋外に,[アウトサイド],Let's go outside.,外に行きましょう。
525,ＢＳ,２年,90-91,quietly,副詞,静かに,[クワイエトリー],He entered quietly.,彼は静かに入りました。
526,ＢＳ,２年,90-91,tooth,名詞,歯,[トゥース],I brushed one tooth.,私は1本の歯を磨きました。
527,ＢＳ,２年,90-91,teeth,,tooth の複数形,[ティース],I brush my teeth every day.,私は毎日歯を磨きます。
528,ＢＳ,２年,90-91,began,動詞,begin の過去形,[ビガン],The show began at 7.,そのショーは7時に始まりました。
529,ＢＳ,２年,90-91,ran,動詞,run の過去形,[ラン],He ran to school.,彼は学校へ走って行きました。
530,ＢＳ,２年,90-91,woke,動詞,wake の過去形,[ウォーク],I woke at sunrise.,私は日の出に目を覚ましました。
531,ＢＳ,２年,90-91,get dressed,,服を着る、着替える,[ゲット・ドレスト],Let's get dressed now.,さあ、服を着ましょう。
532,ＢＳ,２年,90-91,run out into ～,,走って～へ出ていく,[ラン・アウト・イン・トゥ ～],The cat ran out into the yard.,猫が庭に飛び出しました。
533,ＢＳ,２年,90-91,on top of ～,,～の上に,[オン・トップ・オブ ～],The cat sat on top of the car.,猫が車の上に座っていました。
534,ＢＳ,２年,90-91,～ piece(s) of …,,～個の…,[～ ピース・オブ …],I ate two pieces of cake.,私はケーキを2切れ食べました。
535,ＢＳ,２年,90-91,at last,,ついに,[アット・ラスト],"At last, we arrived.",ついに私たちは到着しました。
536,ＢＳ,２年,90-91,I'd love to.,,喜んで。,[アイド・ラヴ・トゥ],I'd love to join you.,ぜひご一緒したいです。
537,ＢＳ,２年,90-91,so as not to ～,,～することがないように,[ソー・アズ・ノット・トゥ ～],I left early so as not to be late.,遅れないように早く出ました。
538,ＢＳ,２年,90-91,come to mind,,思い浮かぶ,[カム・トゥ・マインド],Your name came to mind.,あなたの名前が思い浮かびました。
539,ＢＳ,２年,90-91,～ until …,,～してやがて…,[～ アンティル …],Stay here until I return.,私が戻るまでここにいてください。
540,ＢＳ,２年,92-93,middle,名詞,真ん中,[ミドル],She stood in the middle.,彼女は真ん中に立っていました。
541,ＢＳ,２年,92-93,north,名詞,北,[ノース],We went north.,私たちは北へ行きました。
542,ＢＳ,２年,92-93,scarf,名詞,スカーフ,[スカーフ],She wore a scarf.,彼女はマフラーをしていました。
543,ＢＳ,２年,92-93,heap,名詞,山、かたまり,[ヒープ],There's a heap of clothes.,服の山があります。
544,ＢＳ,２年,92-93,adventure,名詞,冒険,[アドベンチャー],Let's go on an adventure.,冒険に出かけましょう。
545,ＢＳ,２年,92-93,land,動詞,地面に降りる,[ランド],They landed safely.,彼らは無事に着陸しました。
546,ＢＳ,２年,92-93,flew,動詞,fly の過去形,[フルー],The bird flew away.,その鳥は飛び去りました。
547,ＢＳ,２年,92-93,remain,動詞,とどまる,[リメイン],Some buildings remain.,いくつかの建物が残っています。
548,ＢＳ,２年,92-93,lovely,副詞,美しい,[ラヴリー],What a lovely day!,なんて素敵な日でしょう！
549,ＢＳ,２年,92-93,melted,形容詞,溶けた,[メルテッド],The snowman melted.,雪だるまが溶けました。
550,ＢＳ,２年,92-93,snowmen,名詞,snowman の複数形,[スノーマン],We made snowmen.,私たちは雪だるまを作りました。
551,ＢＳ,２年,92-93,Father Christmas,名詞,サンタクロース,[ファザー・クリスマス],Father Christmas is coming!,サンタクロースが来ます！
552,ＢＳ,２年,92-93,at the end of ～,,～の終わりに,[アット・ジ・エンド・オブ ～],"At the end of the movie, they smiled.",映画の終わりに彼らは笑いました。
553,ＢＳ,２年,92-93,in the middle of ～,,～の真ん中に,[イン・ジ・ミドル・オブ ～],He shouted in the middle of class.,授業中に彼は叫びました。
554,ＢＳ,２年,92-93,take place,,（行事などが）行われる,[テイク・プレイス],The festival will take place soon.,祭りはまもなく開催されます。
555,ＢＳ,２年,92-93,somewhere ahead,,どこか前の方で,[サムウェア・アヘッド],There is something somewhere ahead.,前方のどこかに何かがあります。
556,ＢＳ,２年,92-93,feel in one's pocket,,ポケットの中を手探りする,[フィール・イン・ワンズ・ポケット],I felt a coin in my pocket.,ポケットの中のコインを感じました。
557,ＢＳ,２年,95-97,site,,場所,[サイト],This is a famous site.,ここは有名な場所です。
558,ＢＳ,２年,95-97,World Heritage Site,,世界遺産（地）,[ワールド・ヘリテージ・サイト],It's a World Heritage Site.,それは世界遺産です。
559,ＢＳ,２年,95-97,Anyone else?,,ほかにだれかいますか。,[エニワン・エルス？],Anyone else wants to try?,他に誰かやりたい人はいますか？
560,ＢＳ,２年,95-97,take a close look at ～,,～を詳しく調べる、よく見る,[テイク・ア・クローズ・ルック・アット ～],Take a close look at this photo.,この写真をよく見てください。
561,ＢＳ,２年,95-97,protection,名詞,保護,[プロテクション],We need protection from the cold.,寒さから身を守る必要があります。
562,ＢＳ,２年,95-97,distance,名詞,距離,[ディスタンス],Keep a safe distance.,安全な距離を保ちましょう。
563,ＢＳ,２年,95-97,danger,名詞,危険,[デンジャー],That animal is in danger.,その動物は危険な状態にあります。
564,ＢＳ,２年,95-97,scenery,名詞,景色、光景,[シーナリー],The scenery here is beautiful.,ここの景色は美しいです。
565,ＢＳ,２年,95-97,nothing,名詞,何も～ない,[ナッシング],I saw nothing in the box.,箱の中には何も見えませんでした。
566,ＢＳ,２年,95-97,safe,形容詞,安全な,[セーフ],This area is safe.,この地域は安全です。
567,ＢＳ,２年,95-97,rare,形容詞,まれな、珍しい,[レア],That bird is very rare.,その鳥はとても珍しいです。
568,ＢＳ,２年,95-97,among,前置詞,～の間に[で],[アモング],He stood among his friends.,彼は友達の中に立っていました。
569,ＢＳ,２年,95-97,including,,～を含めて,[インクルーディング],"Everyone, including Tom, came.",トムを含む全員が来ました。
570,ＢＳ,２年,95-97,square kilometer,,平方キロメートル,[スクエア・キロメーター],The forest covers one square kilometer.,その森は1平方キロメートルの広さです。
571,ＢＳ,２年,95-97,kilometer per hour,,時速～キロメートル,[キロメーター・パー・アワー],The car went 60 kilometers per hour.,車は時速60キロで走っていました。
572,ＢＳ,２年,95-97,nothing but ～,,～しかない、～だけ,[ナッシング・バット ～],She ate nothing but cake.,彼女はケーキしか食べませんでした。
573,ＢＳ,２年,95-97,not only ～ but also …,,～だけでなく…も,[ノット・オンリー ～ バット・オルソ …],He is not only kind but also smart.,彼は親切なだけでなく頭も良いです。
574,ＢＳ,２年,98-99,space,名詞,空間、スペース,[スペース],There's a lot of space in this room.,この部屋にはたくさんの空間があります。
575,ＢＳ,２年,98-99,picture book,,絵本,[ピクチャー・ブック],She read a picture book.,彼女は絵本を読みました。
576,ＢＳ,２年,98-99,climate,名詞,気候、天候,[クライメイト],The climate here is warm.,ここの気候は暖かいです。
577,ＢＳ,２年,98-99,result,名詞,結果,[リザルト],That was the final result.,それが最終結果でした。
578,ＢＳ,２年,98-99,comment,名詞,コメント,[コメント],He left a kind comment.,彼は親切なコメントを残しました。
579,ＢＳ,２年,98-99,author,名詞,著者,[オーサー],She is a famous author.,彼女は有名な作家です。
580,ＢＳ,２年,98-99,novelist,名詞,小説家,[ノヴェリスト],He wants to be a novelist.,彼は小説家になりたいです。
581,ＢＳ,２年,98-99,crime,名詞,犯罪,[クライム],The police stopped the crime.,警察は犯罪を止めました。
582,ＢＳ,２年,98-99,none,代名詞,だれも～でない,[ナン],None of them came.,誰も来ませんでした。
583,ＢＳ,２年,98-99,consider,動詞,～のことをよく考える,[コンシダー],Let's consider the options.,選択肢を考えましょう。
584,ＢＳ,２年,98-99,steep,形容詞,（傾斜が）急な,[スティープ],The road is very steep.,その道はとても急です。
585,ＢＳ,２年,98-99,historical,形容詞,歴史的な,[ヒストリカル],We visited a historical site.,私たちは歴史的な場所を訪れました。
586,ＢＳ,２年,98-99,surprising,形容詞,びっくりするような,[サプライズィング],That's a surprising answer.,それは驚くべき答えです。
587,ＢＳ,２年,98-99,shape,名詞,形、外形,[シェイプ],This rock has a strange shape.,この岩は奇妙な形をしています。
588,ＢＳ,２年,98-99,slid,動詞,slide の過去形,[スライド],The ball slid across the floor.,ボールは床の上を滑りました。
589,ＢＳ,２年,98-99,slide off,,滑り落ちる,[スライド・オフ],The cup may slide off the table.,カップがテーブルから滑り落ちるかもしれません。
590,ＢＳ,２年,98-99,pie chart,,円グラフ,[パイ・チャート],This pie chart shows the data.,この円グラフはデータを示しています。
591,ＢＳ,２年,98-99,main meal,,主食,[メイン・ミール],Dinner is the main meal.,夕食が主な食事です。
592,ＢＳ,２年,98-99,be adapted for ～,,～に適した,[ビー・アダプテッド・フォー ～],The movie was adapted for TV.,その映画はテレビ用に翻案されました。
593,ＢＳ,２年,98-99,be easy to ～,,簡単に～できる,[ビー・イージー・トゥ ～],This app is easy to use.,このアプリは使いやすいです。
594,ＢＳ,２年,100-101,fact,名詞,事実,[ファクト],That's a scientific fact.,それは科学的事実です。
595,ＢＳ,２年,100-101,plant,名詞,植物,[プラント],They planted a tree.,彼らは木を植えました。
596,ＢＳ,２年,100-101,desert,名詞,砂漠,[デザート],The camel lives in the desert.,ラクダは砂漠に住んでいます。
597,ＢＳ,２年,100-101,emu,名詞,エミュー,[エミュー],An emu can't fly.,エミューは飛べません。
598,ＢＳ,２年,100-101,hop,動詞,跳躍、飛びはねる,[ホップ],The kangaroo can hop.,カンガルーは跳ねます。
599,ＢＳ,２年,100-101,centimeter,名詞,センチメートル,[センチメーター],It is 10 centimeters long.,それは長さ10センチです。
600,ＢＳ,２年,100-101,sloth,名詞,ナマケモノ,[スロス],A sloth moves slowly.,ナマケモノはゆっくり動きます。
601,ＢＳ,２年,100-101,kilogram,名詞,キログラム,[キログラム],The bag weighs 2 kilograms.,そのバッグは2キロあります。
602,ＢＳ,２年,100-101,second,名詞,秒,[セカンド],Wait for a second.,少し待ってください。
603,ＢＳ,２年,100-101,ban,動詞,～を禁止する,[バン],The city banned smoking.,その都市は喫煙を禁止しました。
604,ＢＳ,２年,100-101,surrounding,形容詞,周囲の,[サラウディング],The surrounding area is quiet.,周辺の地域は静かです。
605,ＢＳ,２年,100-101,sacred,形容詞,神聖な,[セイクレッド],This mountain is sacred.,この山は神聖です。
606,ＢＳ,２年,100-101,however,接続詞句,しかしながら,[ハウエヴァー],"However, he didn't agree.",しかし、彼は同意しませんでした。
607,ＢＳ,２年,100-101,nature,名詞,自然,[ネイチャー],We must protect nature.,私たちは自然を守らなければなりません。
608,ＢＳ,２年,100-101,in fact,,実際には、実のところ,[イン・ファクト],"In fact, she was right.",実は、彼女が正しかったのです。
609,ＢＳ,２年,100-101,more than just ～,,ただの～ではない,[モア・ザン・ジャスト ～],This job is more than just work.,この仕事はただの仕事以上のものです。
610,ＢＳ,２年,100-101,ban ～ from -ing,,～が－することを禁止する,[バン ～ フロム -ing],They banned us from entering.,彼らは私たちが入るのを禁止しました。
611,ＢＳ,２年,100-101,in one hop,,ひと飛びで,[イン・ワン・ホップ],The frog crossed the street in one hop.,カエルは一跳びで道を渡りました。
612,ＢＳ,２年,100-101,as you can see,,ご覧のとおり,[アズ・ユー・キャン・シー],"As you can see, this is the result.",ご覧の通り、これが結果です。
613,ＢＳ,２年,102-104,list,名詞,リスト、一覧表,[リスト],Make a list of names.,名前のリストを作ってください。
614,ＢＳ,２年,102-104,project,名詞,プロジェクト、計画,[プロジェクト],This is our school project.,これは私たちの学校のプロジェクトです。
615,ＢＳ,２年,102-104,hotel,名詞,ホテル,[ホテル],We stayed at a hotel.,私たちはホテルに泊まりました。
616,ＢＳ,２年,102-104,government,名詞,政府,[ガバメント],The government made a new law.,政府は新しい法律を作りました。
617,ＢＳ,２年,102-104,development,名詞,開発（事業）,[ディベロップメント],There's a lot of development here.,この地域は開発が進んでいます。
618,ＢＳ,２年,102-104,generation,名詞,世代（の人々）,[ジェネレーション],This is the next generation.,これは次の世代です。
619,ＢＳ,２年,102-104,increase,動詞,増える、増加する,[インクリース],The price will increase.,価格が上がるでしょう。
620,ＢＳ,２年,102-104,risk,動詞,～を危険にさらす,[リスク],There is a risk of fire.,火事の危険があります。
621,ＢＳ,２年,102-104,control,動詞,～を管理する,[コントロール],You must control your temper.,あなたは感情をコントロールする必要があります。
622,ＢＳ,２年,102-104,living,形容詞,生の、生きた,[リビング],He is living in Japan.,彼は日本に住んでいます。
623,ＢＳ,２年,102-104,foreign,形容詞,外来の、外国の,[フォーリン],She speaks a foreign language.,彼女は外国語を話します。
