No.,大項目,中項目,ページ,単語,品詞,意味,発音,例文,和訳
206,ＮＨ,２年,54-56,feel,動詞,…と感じる、気持ちがする,[フィール],I feel happy today.,今日は気分が良いです。
207,ＮＨ,２年,54-56,enter,動詞,（場所）に入る,[エンター],Please enter the room quietly.,静かに部屋に入ってください。
208,ＮＨ,２年,54-56,carefully,副詞,注意深く,[ケアフリー],You should drive carefully in bad weather.,悪天候では慎重に運転するべきです。
209,ＮＨ,２年,54-56,felt,動詞,feel の過去形,[フェルト],She felt nervous before the test.,彼女はテストの前に緊張していました。
210,ＮＨ,２年,54-56,kept,動詞,keep の過去形,[ケプト],He kept the secret from everyone.,彼はみんなに秘密を守り続けました。
211,ＮＨ,２年,54-56,couldn't,,could not の短縮形,[クッドント],I couldn't find my keys this morning.,今朝、鍵が見つかりませんでした。
212,ＮＨ,２年,54-56,take off,,（服など）を脱ぐ,[テイク オフ],Please take off your shoes before entering the house.,家に入る前に靴を脱いでください。
213,ＮＨ,２年,54-56,feel like …ing,,…したい気がする,[フィール ライク],I feel like going for a walk.,散歩に行きたい気分です。
214,ＮＨ,２年,54-56,each other,,たがい（に）,[イーチ アザー],They love each other very much.,彼らはお互いにとても愛し合っています。
215,ＮＨ,２年,54-56,keep …ing,,…し続ける,[キープ イング],She keeps practicing every day.,彼女は毎日練習を続けています。
216,ＮＨ,２年,54-56,in the future,,未来に、将来に,[イン ザ フューチャー],"In the future, I want to travel the world.",将来的には世界を旅したいです。
217,ＮＨ,２年,57,Mrs.,,（結婚している女性をさして）…さん、先生,[ミセス],Mrs. Smith is my neighbor.,スミスさんは私の隣人です。
218,ＮＨ,２年,57,introduce,動詞,…を紹介する,[イントロデュース],Let me introduce you to my friend.,あなたに私の友達を紹介します。
219,ＮＨ,２年,57,precious,形容詞,貴重な、大切な,[プレシャス],This watch is very precious to me.,この時計は私にとって非常に大切です。
220,ＮＨ,２年,57,able,形容詞,（be able to で）…することができる,[エイブル],I will be able to help you tomorrow.,明日、あなたを手伝うことができると思います。
221,ＮＨ,２年,57,be able to,,…することができる,[ビー エイブル トゥ],Are you able to fix the car?,車を修理できるかもしれませんか？
222,ＮＨ,２年,57,"Best wishes,",,それでは。（手紙の結びの言葉）,[ベスト ウィッシズ],Best wishes for your new job!,新しい仕事に幸運を祈ります！
223,ＮＨ,２年,59-60,bottle,名詞,びん、ボトル,[ボトル],She opened a bottle of water.,彼女は水のボトルを開けました。
224,ＮＨ,２年,59-60,product,名詞,製品,[プロダクト],This product is on sale today.,この製品は今日セール中です。
225,ＮＨ,２年,59-60,design,名詞,デザイン,[デザイン],The design of the building is beautiful.,その建物のデザインは美しいです。
226,ＮＨ,２年,59-60,fair,名詞,博覧会、フェア,[フェア],The carnival was very fair.,お祭りはとても公平でした。
227,ＮＨ,２年,59-60,facility,名詞,施設、設備,[ファシリティ],This facility has a gym and pool.,この施設にはジムとプールがあります。
228,ＮＨ,２年,59-60,city hall,,市役所,[シティ ホール],I need to go to city hall for the meeting.,市役所に行かなければなりません。
229,ＮＨ,２年,59-60,touch,動詞,…にさわる、ふれる,[タッチ],Please don't touch anything on the desk.,デスクの上のものに触らないでください。
230,ＮＨ,２年,59-60,universal,形容詞,全ての人々の,[ユニバーサル],This idea is universal and can be applied anywhere.,このアイデアは普遍的で、どこでも適用できます。
231,ＮＨ,２年,59-60,automatic,形容詞,自動式の、機械的な,[オートマチック],The door is automatic and opens by itself.,そのドアは自動で開きます。
232,ＮＨ,２年,59-60,adjustable,形容詞,調節可能な,[アジャスタブル],The chair is adjustable to any height.,その椅子は高さを調整できます。
233,ＮＨ,２年,59-60,public,形容詞,公の、公共の,[パブリック],The public library is very quiet.,公共の図書館はとても静かです。
234,ＮＨ,２年,61,staff,名詞,職員、従業員,[スタッフ],The staff at the hotel are very friendly.,ホテルのスタッフはとても親切です。
235,ＮＨ,２年,61,castanets,名詞,カスタネット,[カスタネット],She played the castanets at the concert.,彼女はコンサートでカスタネットを演奏しました。
236,ＮＨ,２年,61,tap,動詞,…を軽くたたく,[タップ],He gave a tap on the door to get their attention.,彼はドアをノックして注意を引きました。
237,ＮＨ,２年,61,left-handed,形容詞,左利きの、左利き用の,[レフト ハンディッド],He is left-handed and writes with his left hand.,彼は左利きで、左手で書きます。
238,ＮＨ,２年,61,right-handed,形容詞,右利きの、右利き用の,[ライト ハンディッド],She is right-handed and uses her right hand to write.,彼女は右利きで、右手で書きます。
239,ＮＨ,２年,61,both … and ～,,…も～も両方,[ボウス アンド],Both my brother and sister love playing soccer.,私の兄も妹もサッカーをするのが大好きです。
240,ＮＨ,２年,61,over here,,こちらに、こちらでは,[オーバー ヒア],You can sit over here if you like.,こちらに座ってもいいですよ。
241,ＮＨ,２年,61,thanks to,,…のおかげで,[サンクス トゥ],"Thanks to her hard work, we finished on time.",彼女の努力のおかげで、私たちは時間通りに終わりました。
242,ＮＨ,２年,62-63,baby,名詞,赤ん坊,[ベイビー],The baby is sleeping in the crib.,赤ちゃんはベビーベッドで寝ています。
243,ＮＨ,２年,62-63,sign,名詞,記号、符号,[サイン],Please sign your name at the bottom of the form.,フォームの下にサインしてください。
244,ＮＨ,２年,62-63,ramp,名詞,スロープ,[ランプ],The ramp is easier to use than the stairs.,ランプは階段よりも使いやすいです。
245,ＮＨ,２年,62-63,stair,名詞,（複数形で）階段,[ステア],I can't climb the stairs with my suitcase.,スーツケースを持って階段を登れません。
246,ＮＨ,２年,62-63,wheelchair,名詞,車いす,[ウィールチェア],The wheelchair is in the hallway.,車椅子は廊下にあります。
247,ＮＨ,２年,62-63,baggage,名詞,手荷物,[バゲージ],The baggage claim area is over there.,手荷物受取所はあちらにあります。
248,ＮＨ,２年,62-63,presentation,名詞,発表、プレゼンテーション,[プレゼンテーション],Her presentation was very interesting.,彼女のプレゼンテーションはとても興味深かったです。
249,ＮＨ,２年,62-63,pull,動詞,…をひく、ひっぱる,[プル],Please pull the door to open it.,ドアを引いて開けてください。
250,ＮＨ,２年,62-63,useful,形容詞,役に立つ、有用な,[ユースフル],This tool is very useful for fixing things.,この道具は物を直すのにとても役立ちます。
251,ＮＨ,２年,62-63,young,形容詞,若い、幼い,[ヤング],He is still very young but very smart.,彼はまだとても若いですが、とても賢いです。
252,ＮＨ,２年,64-66,professor,名詞,教授,[プロフェッサー],The professor gave an interesting lecture today.,教授は今日は興味深い講義をしました。
253,ＮＨ,２年,64-66,childhood,名詞,子供のころ,[チャイルドフッド],I have many fond memories from my childhood.,私の子供時代にはたくさんの楽しい思い出があります。
254,ＮＨ,２年,64-66,barrier,名詞,壁、障壁,[バリア],The language barrier was difficult to overcome.,言語の壁は克服するのが難しかったです。
255,ＮＨ,２年,64-66,ability,名詞,能力、…できること,[アビリティ],Her ability to solve problems is impressive.,彼女の問題解決能力は素晴らしいです。
256,ＮＨ,２年,64-66,situation,名詞,立場、境遇,[シチュエーション],"In this situation, we should stay calm.",この状況では、冷静を保つべきです。
257,ＮＨ,２年,64-66,center,名詞,中心地、センター,[センター],The center of the city is always busy.,市の中心はいつも賑やかです。
258,ＮＨ,２年,64-66,remove,動詞,…を取り除く,[リムーブ],Can you remove the book from the shelf?,棚から本を取ってくれますか？
259,ＮＨ,２年,64-66,found,動詞,…を創立する,[ファウンド],I found my keys under the table.,テーブルの下に鍵を見つけました。
260,ＮＨ,２年,64-66,spread,動詞,…を広げる、広める,[スプレッド],The news about the event quickly spread.,その出来事についてのニュースはすぐに広まりました。
261,ＮＨ,２年,64-66,American,形容詞,アメリカ[人]の,[アメリカン],He is American and lives in New York.,彼はアメリカ人でニューヨークに住んでいます。
262,ＮＨ,２年,64-66,disabled,形容詞,体の不自由な,[ディサブルド],People with disabilities should have equal opportunities.,障害のある人々は平等な機会を持つべきです。
263,ＮＨ,２年,64-66,accessible,形容詞,行くことのできる,[アクセスブル],The building is accessible for people with wheelchairs.,その建物は車椅子の人々にもアクセス可能です。
264,ＮＨ,２年,64-66,spread,動詞,spread の過去形,[スプレッド],The rumor about the party quickly spread.,その噂はすぐに広まりました。
265,ＮＨ,２年,64-66,1970s,,1970年代,[1970ズ],"In the 1970s, many cultural changes took place.",1970年代には多くの文化的な変化がありました。
266,ＮＨ,２年,64-66,regardless of,,…にかかわらず,[リガードレス オブ],You can succeed regardless of your background.,あなたのバックグラウンドに関係なく、成功できます。
267,ＮＨ,２年,69-70,trivia,形容詞,雑学的な知識,[トリビア],The trivia game was really fun.,そのトリビアゲームはとても楽しかったです。
268,ＮＨ,２年,69-70,quiz,名詞,クイズ,[クイズ],We had a quiz in class today.,今日はクイズがありました。
269,ＮＨ,２年,69-70,court,名詞,コート,[コート],They played tennis on the court.,彼らはコートでテニスをしました。
270,ＮＨ,２年,69-70,than,接続詞,…よりも,[ゼン],This book is better than the other one.,この本は他の本よりも良いです。
271,ＮＨ,２年,71,survey,名詞,調査,[サーベイ],The survey showed that most people prefer online shopping.,調査結果では、ほとんどの人がオンラインショッピングを好むことが示されています。
272,ＮＨ,２年,71,curling,名詞,カーリング,[カーリング],Curling is a popular sport in Canada.,カーリングはカナダで人気のスポーツです。
273,ＮＨ,２年,71,strategy,名詞,戦略、作戦、計画,[ストラテジー],She developed a winning strategy for the game.,彼女はゲームの勝つための戦略を開発しました。
274,ＮＨ,２年,71,skill,名詞,腕前、技術,[スキル],His skill at playing the guitar is amazing.,彼のギターの演奏技術は素晴らしいです。
275,ＮＨ,２年,71,more,形容詞,もっと,[モア],He wants more books to read.,彼はもっと本を読みたいと思っています。
276,ＮＨ,２年,71,most,形容詞,いちばん…、最も…,[モウスト],This is the most beautiful place I've ever seen.,これは私が今まで見た中で最も美しい場所です。
277,ＮＨ,２年,72-73,half,名詞,半分、２分の１,[ハーフ],Half of the team is already here.,チームの半分はすでにここにいます。
278,ＮＨ,２年,72-73,graph,名詞,グラフ、図表,[グラフ],The graph shows the sales for each month.,グラフは各月の売上を示しています。
279,ＮＨ,２年,72-73,percent,名詞,パーセント,[パーセント],He earned 80 percent of the votes.,彼は80パーセントの票を得ました。
280,ＮＨ,２年,72-73,conclusion,名詞,結論、決定、結果,[コンクルージョン],The conclusion of the study was clear.,その研究の結論は明確でした。
281,ＮＨ,２年,72-73,such,副詞,そのような、このような,[サッチ],Such a big decision should not be taken lightly.,そんな大きな決断は軽々しく決めるべきではありません。
282,ＮＨ,２年,72-73,better,形容詞,よりよく、より以上に,[ベター],You can do better next time.,次回はもっと良くできるはずです。
283,ＮＨ,２年,72-73,according to,,…によれば,[アコーディング トゥ],"According to the report, sales are up this year.",報告書によると、今年の売上は増加しています。
284,ＮＨ,２年,72-73,as for,,…について言えば,[アズ フォー],"As for the meeting, it starts at 3 PM.",会議については、3時に始まります。
285,ＮＨ,２年,72-73,… such as ～,,～のような…,[サッチ アズ],"There are many sports, such as basketball and soccer.",バスケットボールやサッカーなど、たくさんのスポーツがあります。
286,ＮＨ,２年,72-73,in conclusion,,最後に、結論として,[イン コンクルージョン],"In conclusion, we should all contribute to the project.",結論として、このプロジェクトにはみんなが貢献すべきです。
287,ＮＨ,２年,72-73,more than,,…より多くの人[もの、こと],[モア ザン],The event had more than 100 participants.,そのイベントには100人以上が参加しました。
288,ＮＨ,２年,74-76,topic,名詞,話題、トピック,[トピック],The topic of the meeting was technology.,会議のトピックは技術でした。
289,ＮＨ,２年,74-76,letter,名詞,文字,[レター],I received a letter from my friend yesterday.,昨日、友達から手紙をもらいました。
290,ＮＨ,２年,74-76,feedback,名詞,意見、フィードバック,[フィードバック],Please provide feedback on the presentation.,プレゼンテーションについてフィードバックをお願いします。
291,ＮＨ,２年,74-76,speaker,名詞,話す人、演説者,[スピーカー],The speaker gave a powerful speech.,スピーカーは力強いスピーチをしました。
292,ＮＨ,２年,74-76,content,名詞,中身、内容,[コンテンツ],The content of the book was very engaging.,その本の内容はとても魅力的でした。
293,ＮＨ,２年,74-76,delivery,名詞,話しぶり,[デリバリー],The delivery of the package is delayed.,そのパッケージの配達は遅れています。
294,ＮＨ,２年,74-76,contact,名詞,接触,[コンタクト],Please contact me if you need any help.,助けが必要な場合は私に連絡してください。
295,ＮＨ,２年,74-76,comment,名詞,批評、コメント,[コメント],He left a comment on the blog post.,彼はブログ投稿にコメントを残しました。
296,ＮＨ,２年,74-76,data,名詞,資料、データ,[データ],The data shows an increase in sales.,データは売上の増加を示しています。
297,ＮＨ,２年,74-76,slide,名詞,スライド,[スライド],I will slide the window open for you.,私は窓をスライドして開けます。
298,ＮＨ,２年,74-76,spoke,動詞,speak の過去形,[スポーク],She spoke clearly during the presentation.,彼女はプレゼンテーション中に明確に話しました。
299,ＮＨ,２年,77,direction,名詞,方向、方角,[ダイレクション],The road is in the wrong direction.,道は間違った方向にあります。
300,ＮＨ,２年,77,goodbye,名詞,さようなら,[グッドバイ],"Goodbye, and have a great day!",さようなら、良い一日を！
301,ＮＨ,２年,77,Shall I[we] …?,,…しましょうか。,[シャル アイ[ウィ]],Shall I help you with your bags?,荷物を持つお手伝いをしましょうか？
302,ＮＨ,２年,80-83,field,名詞,競技場、フィールド,[フィールド],He works in the medical field.,彼は医療分野で働いています。
303,ＮＨ,２年,80-83,turf,名詞,芝、芝地,[ターフ],The grass on the turf was freshly cut.,芝生の草は刈りたてだった。
304,ＮＨ,２年,80-83,video,名詞,映像、動画,[ビデオ],I watched a video about space exploration.,私は宇宙探査に関するビデオを見ました。
305,ＮＨ,２年,80-83,artificial,形容詞,人工の、人工的な,[アーティフィシャル],The park has an artificial lake.,公園には人工の湖があります。
306,ＮＨ,２年,80-83,unique,形容詞,特有の、独特な,[ユニーク],Her necklace is unique and beautiful.,彼女のネックレスはユニークで美しいです。
307,ＮＨ,２年,80-83,almost,副詞,ほとんど,[オールモスト],I almost missed the bus this morning.,私は今朝バスに乗り遅れそうになりました。
308,ＮＨ,２年,80-83,clean up,,きれいにそうじする,[クリーン アップ],Please clean up your room before dinner.,夕食前に部屋を片付けてください。
309,ＮＨ,２年,80-83,belong to,,…に所属する,[ビロング トゥ],This book belongs to Sarah.,この本はサラのものです。
310,ＮＨ,２年,84-85,kindness,名詞,親切、親切な行為,[カインドネス],He showed kindness by helping the elderly.,彼は高齢者を助けて親切さを示しました。
311,ＮＨ,２年,84-85,herself,代名詞,彼女自身、自ら,[ハーセルフ],She did everything herself without any help.,彼女は自分一人で何もかもしました。
312,ＮＨ,２年,84-85,sell,動詞,…を売る,[セル],They decided to sell their old car.,彼らは古い車を売ることに決めました。
313,ＮＨ,２年,84-85,pay,動詞,（代金などを）払う,[ペイ],I will pay for the meal today.,今日の食事は私が払います。
314,ＮＨ,２年,84-85,wonder,動詞,思いをめぐらす,[ワンダー],I wonder what the weather will be like tomorrow.,明日の天気がどうなるか気になります。
315,ＮＨ,２年,84-85,hope,動詞,…を望む、…だとよいと思う,[ホープ],I hope you have a wonderful day!,素晴らしい一日をお過ごしください！
316,ＮＨ,２年,84-85,earn,動詞,…をかせぐ,[アーン],He works hard to earn a living.,彼は生計を立てるために一生懸命働いています。
317,ＮＨ,２年,84-85,knock,動詞,ノックする,[ノック],She knocked on the door before entering.,彼女は入る前にドアをノックしました。
318,ＮＨ,２年,84-85,reply,動詞,…と答える,[リプライ],I will reply to your email later.,後であなたのメールに返信します。
319,ＮＨ,２年,84-85,poor,形容詞,貧しい、かわいそうな,[プア],The poor family struggles to make ends meet.,その貧しい家族は生活費を稼ぐのに苦労しています。
320,ＮＨ,２年,84-85,rich,形容詞,金持ちの、裕福な,[リッチ],He is rich and owns many properties.,彼は裕福で多くの不動産を所有しています。
321,ＮＨ,２年,84-85,few,形容詞,少しの,[フュー],There are only a few apples left in the basket.,バスケットにはあと少しだけリンゴがあります。
322,ＮＨ,２年,84-85,well-off,形容詞,裕福な,[ウェルオフ],The well-off family donates to charity.,裕福な家族は慈善団体に寄付しています。
323,ＮＨ,２年,84-85,once,副詞,かって、以前、昔,[ワンス],"Once you finish your work, we can go.",あなたが仕事を終えたら、私たちは出かけられます。
324,ＮＨ,２年,84-85,away,副詞,はなれて、去って,[アウェイ],The ball flew away across the field.,ボールはフィールドの向こうに飛んでいきました。
325,ＮＨ,２年,84-85,a glass of,,コップ１杯（の量）の,[ア グラス オブ],Would you like a glass of juice?,ジュースを一杯いかがですか？
326,ＮＨ,２年,84-85,a few,,小数の、いくらかの,[ア フュー],I have a few friends coming over tonight.,今夜、少し友達が来ます。
327,ＮＨ,２年,84-85,be about to,,今にも…しようとしている,[ビー アバウト トゥ],I am about to leave the house.,私は今、家を出るところです。
328,ＮＨ,２年,84-85,with a smile,,にっこり笑って,[ウィズ ア スマイル],She greeted me with a smile.,彼女は笑顔で私を迎えました。
329,ＮＨ,２年,84-85,do well,,元気になる,[ドゥ ウェル],I am sure you will do well on the test.,テストでうまくいくことを確信しています。
330,ＮＨ,２年,86-87,operation,名詞,手術,[オペレーション],The operation was successful and she is recovering.,手術は成功し、彼女は回復しています。
331,ＮＨ,２年,86-87,envelope,名詞,封筒,[エンヴェロープ],Please place the letter in the envelope.,手紙を封筒に入れてください。
332,ＮＨ,２年,86-87,bill,名詞,請求書,[ビル],The bill for dinner was $50.,ディナーの請求書は50ドルでした。
333,ＮＨ,２年,86-87,send,動詞,（～に）…をおくる,[センド],I will send the invitation next week.,来週、招待状を送ります。
334,ＮＨ,２年,86-87,afraid,形容詞,こわがって,[アフレイド],He is afraid of spiders.,彼はクモが怖いです。
335,ＮＨ,２年,86-87,ill,形容詞,病気で、ぐあいが悪い,[イル],She is ill and needs to rest.,彼女は病気で、休まなければなりません。
336,ＮＨ,２年,86-87,alive,形容詞,生きて、生きた状態で,[アライブ],It's good to be alive after such a scary accident.,こんなに怖い事故の後、生きていることが良かったです。
337,ＮＨ,２年,86-87,paid,形容詞,支払い済みの,[ペイド],He already paid for the tickets.,彼はすでにチケットを支払い済みです。
338,ＮＨ,２年,86-87,inside,前置詞,内側に、内部に,[インサイド],The gift is inside the box.,ギフトは箱の中にあります。
339,ＮＨ,２年,86-87,sent,動詞,send の過去形,[セント],The email was sent this morning.,そのメールは今朝送信されました。
340,ＮＨ,２年,86-87,woke,動詞,wake の過去形,[ウォーク],I woke up early to get ready for the meeting.,私は会議の準備のために早く起きました。
341,ＮＨ,２年,86-87,here's,,here is の短縮形,[ヒアズ],Here's the information you asked for.,これがあなたが求めていた情報です。
342,ＮＨ,２年,86-87,go by,,（時間が）過ぎる、通り過ぎる,[ゴー バイ],We will go by bus to the concert.,私たちはバスでコンサートに行きます。
343,ＮＨ,２年,86-87,in front of,,…の前で[に],[イン フロント オブ],She stood in front of the mirror.,彼女は鏡の前に立っています。
344,ＮＨ,２年,86-87,right away,,すぐに,[ライト アウェイ],I will call you right away.,私はすぐにあなたに電話します。
345,ＮＨ,２年,86-87,be afraid to,,…するのがこわい,[ビー アフレイド トゥ],She is afraid to speak in front of a large crowd.,彼女は大勢の前で話すのを怖がっています。
346,ＮＨ,２年,86-87,in full,,全部,[イン フル],The document must be submitted in full by the deadline.,書類は締め切りまでに完全に提出しなければなりません。
347,ＮＨ,２年,89-90,heritage,名詞,（文化的な）遺産,[ヘリテージ],The castle is a part of our national heritage.,その城は私たちの国の遺産の一部です。
348,ＮＨ,２年,89-90,site,名詞,遺跡,[サイト],The ancient ruins are a popular tourist site.,その古代遺跡は観光地として人気があります。
349,ＮＨ,２年,89-90,selection,名詞,選択,[セレクション],The selection of speakers for the event was impressive.,そのイベントのスピーカーの選定は素晴らしかったです。
350,ＮＨ,２年,89-90,standard,名詞,基準,[スタンダード],We need to meet the standard of quality for the product.,私たちは製品の品質基準を満たさなければなりません。
351,ＮＨ,２年,89-90,conference,名詞,会議、評議会,[カンファレンス],The conference will be held next week in Tokyo.,その会議は来週東京で開催されます。
352,ＮＨ,２年,89-90,decide,動詞,…を決める,[ディサイド],I will decide where to go for vacation soon.,休暇の行き先をすぐに決めます。
353,ＮＨ,２年,89-90,select,動詞,…を選ぶ,[セレクト],Please select your preferred option from the list.,リストから希望のオプションを選んでください。
354,ＮＨ,２年,89-90,natural,形容詞,自然の,[ナチュラル],The park has a natural beauty that attracts visitors.,その公園は自然の美しさで訪問者を魅了しています。
